,sentences
0,i don't think ani one there ha ebola bob latta you should be back in washington actual get someth done there on the hous floor
1,anyth other than jean and t shirt are superflu by the way
2,'updat your wardrobe' pfft
3,meh i could onli get to 8
4,need to work up
5,a bill consist of a singl sentenc
6,veri well done sir
7,so far so good
8,thx
9,my buddi jeff johnson wa your prop master on that
10,she had me at everlast youth
11,congratul to you for a well deserv recognit
12,baffoon idiot dumb
13,the inteleg convers continu
14,they don't deserv that honour stupid hollywood movi busi peopl
15,yawn
16,is thi honestli news
17,same to you brotha
18,get at it
19,would good to know how the age of all of these thing have been measur
20,the perfect societi is shape in the form of a pyramid the old at the top and the young at the bottom support the old
21,if we kill off the young that will take care of us with thier s s tax we will have no support
22,thi is the reason social secur is fail
23,so genuin
24,so true
25,so good and love
26,thank you
27,i am so total go to tri and make thi one
28,thank for the remind
29,wa on holiday in nz a year ago amaz place
30,yeah i recogn you as a mod
31,funni that were have 2 convo in 2 differ place in the same thread
32,damn straight
33,now let get our main lead and the good femal director
34,god bless the children and their family' amen
35,my grandfath had a garden and one of my greatest memori of childhood is have fresh carrot
36,he would pull them straight from the soil wash it off and i would sit and enjoy
37,i still garden to thi day
38,thank for the 4th of juli wish and for all you do for texa
39,did u jerk off when u got back to ur car or did u manag to wait until u got home
40,i would like to volunt to help in your campaign headquart
41,i twitter thi
42,i found it veri excel and insight
43,i onli could watch half of it becaus i wa relat kind of how my life is now
44,i hope to watch the other half or hear from you soon
45,is there a black and a white area
46,we will miss you
47,i think speaker perez marri my sister
48,ha small world
49,boss are not tri to make decis for women
50,they can make their own decis
51,they'll just have to pay for that decis
52,keep your leg shut or have him wear protect duh
53,the foreign exchang restaur support local famili own minor busi
54,incred
55,thank you ami cuddi
56,i realli need thi
57,they are scare to confront him
58,they are fail to follow their sworn oath to protect and defend the constitut
59,what remedi do we have other than vote them out
60,novemb may be too late
61,a pumpkin sit on a pumpkin lmbo
62,sheesh way to put the pressur on guy
63,i guess if you put it that way then sure
64,where would you like to have thi friendli discuss
65,here ok
66,thank you may el khalil you are heroic
67,by bring normalci and peac to lebanes peopl you spread it to all peopl everywher
68,thank you also to ted talk for provid a forum for showcas great idea and the great peopl who dream them so the rest of us can benefit
69,with pleasur
70,thank for your support
71,go congressman
72,just toss some old histori book out the window
73,it sure got my attent
74,thank you so much
75,pleas
76,i need more grimm
77,pleas support congresswoman lowey by follow her campaign account on twitter
78,it' becaus i basic propos marriag to you and you didn't say ye i'm just a littl heartbroken over here
79,let count all the crook politician in the room
80,i see a judg
81,there' a councilman
82,da
83,state senat
84,awesom
85,i never had a doubt
86,hope you'll be do someth like thi in brunswick counti
87,let me know if i can help
88,d i'm more of a happyhyena than a pirahna my old nick
89,http www youtub com watch v uncwmax8c
90,thank
91,i wa close to get mani achiev without even know it so i wrote down what i need to do to get a bunch of them the last few day
92,it wa a fun chang of pace
93,i am feel pretti great
94,today wa my first food cheat day in almost 5 week
95,lol
96,thank you lord jesu for our men and woman who serv their countri and their fellow man faith
97,amen
98,raw milk ha substanti the same nutrit and shouldnt be recommend to unacclim children
99,hi paula
100,i'm honor
101,your tweet and dm' certainli made my day too
102,oh what fun
103,were you follow april
104,awesom articl eric
105,so happi for you
106,i just don't believ you
107,not one inch
108,you may give peopl 8 minut plu but you just wast 19 minut of my time
109,ya hit the nail on the head tom
110,thank for the follow back
111,you are go to hell ed
112,i can't repost thi but i want to
113,you should start log on more often nomsayin
114,tim scott ran as tea parti candid back in 2008 i believ
115,thank god for nikki haley for appoint him
116,i realli doubt the pipe were glow
117,with wisdom and grace guid you bonni go forth and do great thing
118,fascin talk
119,will never look at spider web in the same way wow
120,i hope you said beforehand hey jude don't make it bad
121,whi thank you
122,not as smokin as your though
123,how about restor our civil right obama just sign away
124,more than you know
125,2 3 ow but thi advoc sorri for ani other respond on a phone is difficult sometim
126,good luck speak
127,you will be love becaus you perpetuat
128,ye american with conceal carri permit are role model
129,hahaha what'd you play as thank for the fb
130,the micro organ is found in wetland and marsh
131,what can't wetland do
132,everi event is import you need to stay more focus and forget about social media
133,had so much fun work on that movi
134,saw it with deon roxann and other tonight in sac
135,bresha webb
136,linda s clay did you listen to the 911 call ani good marin know land navig
137,commit to make sure we don't lose our healthcar
138,how
139,specif how
140,you'r welcom
141,i'm sure there will be mani more to come
142,no problem i'v attempt nearli everi sport there is in the book
143,soror marcia so proud so proud of you and your work
144,keep do what god ha you to do
145,pretti your fan are so thank that she had you
146,the bay area ha it best weather in septemb
147,i believ in you tammi you'r great
148,obama administr is hard at work for everyon but american citizen
149,these video make up for the lost time i watch stupid video on youtub
150,no worri and thank for the followback
151,danc is good
152,thi ted talk move me and made me reassess my life
153,i pledg to be more compassion and to be more awar of the countless thing i ought to be grate for
154,i wish i could wake up that earli haha
155,i'v been pretti off track myself and now my leg are stupid
156,but do physio for that now
157,other than that thing are mostli rockin' i hope your summer wa rad other than the fall off
158,hahah you and your manli weight
159,not anymor they dont tbh im happi about the col bandwagon
160,they deserv it
161,clinton is veri hansom
162,thi is so ador
163,thank for back thi up with some industri knowledg i dont actual know much about market but the market guy who ive interact with through work alway do so much more than just manag advertis
164,the reason is simpl social democrat have abandon their principl
165,two beauti women
166,sad it take a tragedi to get peopl to be nice sigh
167,cygna ruin healthspr when it aquir it
168,rachael ray is such a nasti person whi send her down there
169,i miss you too
170,glad you are smangin your workout
171,god bless all that are respond to the fire
172,after watch thi talk i think i'm go to wipe the dust off my copi of wikinom
173,it ha truli spark my interest in thi topic again
174,thank you chelliepingre for stand up for main peopl
175,i believ in her declar of common ground for human
176,bryant i can see whi a conserv like you would be shock and disgust by a member of congress actual tri to help peopl in hi district
177,ye we'r go to revolution processor technolog with vagu word africa magic
178,the 300x300 pixel cartoon of cpu were veri convinc
179,thank you
180,i have been pray for hi releas
181,amaz
182,thank for the follow back
183,a great experi for you shelbi
184,sabin ha one of the toughest serv on the tour
185,hug to you honey
186,i didn't want to go too crazi today becaus tomorrow is gonna be a lot of heavi olymp lift so i decid to blow up some of the easi quest
187,happi halloween for all beauti grimm
188,congrat toni
189,you rate an a with thi teacher
190,sooo excit and happi for you eric
191,yaaa varv
192,great job
193,yay
194,soooo happi to see thi post
195,avoid the chocol
196,they still have not answer the import question
197,pleas do not let thi go away until they answer who call the stand down and whi did they call it
198,great idea
199,earli adopt might have some issu but will be a great way to solv traffic issu
200,thank mate
201,hah
202,ye day by day s
203,we look forward to see you in chanut again
204,yea
205,enjoy it for me
206,i'm stuck in montana
207,not even my childhood fantasi were thi excit
208,and the potenti of such think i cannot even imagin
209,ye the futur is go to be veri much differ and better in so mani way
210,sound good to me
211,when you transfer
212,haha
213,you earn it great work
214,thank for thi post
215,watch home right now it never too late to chang
216,awar bring chang
217,you had excel commentari
218,i am a veri proud constitu
219,9 1 1 is liter a lifelin
220,it is not a wast of time
221,thank you anna
222,if you wanna keep your job you better work toward 9 11 truth and end the feder reserv or you'll be fire in the come year
223,how can you celebr a histori which ha enslav the brother of black color and all other peopl of color for that matter we do not celebr but rememb the atroc by those who came to thi land but to destroy it
224,good for ken what is he do about creat job for the unemploy american citizen
225,haha thank
226,i know they domin my face
227,directli below thi post should be a post that start out
228,21 gun for 22 vet
229,it get delet from 95 of all govern offici page and i hit them all
230,if it is not there it is becaus cannabi threaten someon bank roll
231,here is your sign
232,exactli
233,we are responsbil businesspeopl
234,not everi dollar made by a busi is an attack on the world
235,just against white peopl who pay for high price footbal game which in turn put a big check in hi bank account
236,bite the hand that feed you
237,better way to make your point
238,you are act disrespect and that is what you will get in return
239,wise up
240,wors appolgi for the typo
241,cute as ever mr sapalish
242,lol
243,he'd bounc a lot more than me
244,you'r welcom and thank you
245,stop vote for your parti and start vote for the peopl who put you in offic
246,thought and prayer to everyon
247,wish you much success bro
248,i find myself come back and back to thi talk which is one of the most inspir i'v ever heard
249,sir ken robinson is fascin spot on and veri funni
250,i wish more educ listen to him
251,i recommend hi book out of our mind learn to be creativ
252,i need thi video today
253,thank you for help nomin the weakest possibl candid against trump
254,d
255,if you support the progress democrat parti you are also support anti semit
256,thank for all your support guy 4 more hard session to go so still some work to do
257,but you still support that unstabl rat you call a presid
258,until now though ed sheeran ha basic onli been known for sing
259,he also top 10 most popular singer in the world right now
260,stop be deliber obtus
261,so happi for all you have accomplish so far
262,love thi place on vacat
263,i'v never heard so mani neg campaign commerci from the liber camp in my life
264,they don't want to let go it' a lost caus for them and they have yet to realiz thi
265,they werent wear their hi vi though tut tut
266,glad to see you are with the democrat and the presid
267,glad to see we still have some compet peopl left
268,great job
269,who care about the yank it how it affect our secur im worri about
270,theyr not the friendliest nation to us afteral
271,great quot thank you trent for stand true to your belief
272,i alway cheer when i hear that you'v gotten reelect
273,ive no doubt that it would be heaven to be in either or both
274,good motiv right there
275,that' disrespect trifl smdh
276,ye and canada' presid welcom all our refuge and illeg immigr to canada
277,he want for canada what trump is tri to prevent in the usa
278,veri good talk
279,i wonder what ha been done to tri to breed super spider
280,spider with bigger and bigger silk gland
281,happi fourth of juli to you and famili
282,best way to save the planet is to start get our energi and strateg materi from space
283,it' all out there space is the place and it' closer than some might think
284,becaus it' what complet idiot like yourself drake say when you'v just realiz you onli live onc
285,of cours you fuck do retard
286,veri inspir thi brought me to tear
287,keep up the great work that way we can keep support p
288,i have a friend who volunt there
289,a veri good organ
290,yum just made it
291,so good
292,great talk
293,one of the best in a long time
294,inspir to see young peopl so commit
295,one anoth note
296,whi isn't thi talk in a gender neutral ted
297,it' more than good enough for that
298,love thi amaz courag smart beauti divin woman
299,god bless you hyeonseo lee
300,you are proof that human ha awesom among us
301,i absolut love you on thi show
302,garret k have been keep up with hi vote record
303,when you tie down good legisl with bad legisl which happen all the time sometim you have to vote no and wait to re introduc the same legisl anoth day
304,that doesn't make you a liber just a wise conserv
305,we knew that wa the plan of the dem' all along
306,it sound like they decid to just cut to the chase instead of beat around the bush but the object is the same
307,it' about time
308,the previou senator' experi wa is a failur
309,the np is much better equip to manag thi special resourc
310,when will the public learn that everyth the feder govern doe is not and will never be support on it' own np the postal servic amtrack etc
311,if you think that is shitti music your an idiot with no tast that eat mcdonald and pay for michal bay movi probabl
312,gorgeou
313,u look great
314,love the look crumb and all
315,lol
316,if you go to big the school may rais the fee yeah theyll rais the fee
317,youll have alreadi graduat though leav that fee for the next wave of sucker
318,sourc wa one of the sucker made the follow year even bigger sucker by borrow cutleri and dish
319,hi jane a wonder and insight talk
320,pleas look at the valu game at http ingenesist com introduct we specifi social capit
321,you'll get a kick out of it
322,thank
323,0bama doesn't need marsha to make him look bad
324,he doe that quit well all by himself
325,thank you marsha for all you do
326,hang tough we are with you
327,interest although i wa struck by the fact that there wa no mention of grow human tissu in the lab
328,there are mani case in which stem cell are be leverag to regrow thing like ear for soldier
329,i think a magic beam of pure light would disintegr you
330,gotta keep it open
331,what can we do to help
332,i person hate play with unexperienc player
333,it either a realli bore match or they play stupid thing like 4x tormod crypt in the main board of elv
334,fuck you for keep me out of prize
335,saw it last night
336,you were hilari
337,ahah
338,thank
339,amaz stuff
340,i hope the live organ she document are abl to continu surviv for thousand of year to come
341,melissa spoken like a true republican
342,wow ami so move
343,you realli inspir me
344,thank sarah
345,just got back from the festiv
346,veri fun
347,think beer and clam and hot tub befor the firework
348,happi canada to you
349,how are you feel
350,abl to take in ani of the festiv
351,love my give key
352,i believ it should be the motto of everyth we do
353,lift all the thing
354,d
355,thank you for your support
356,wow
357,i'm at a loss for word
358,amaz
359,thi is biomimicri at it finest
360,great present
361,fabul photograph
362,thank you for share and for your leadership
363,no worri
364,hope you'r well and thank a lot haha
365,amen we r watch geraldo u got thi love you angi
366,nick oxford thi wa the worst thing i'v ever heard danni brown is aw
367,awesom
368,my dream to do that
369,you continu to have my admir and respect
370,feliz ao amigo senador suert en todo
371,exito y salud
372,ya'll have got to read the odd seri
373,love 'em
374,muslim brotherhood who love regular american your live in a dream world neo
375,great
376,30billion down anoth 970 billion more to go
377,great job
378,it' amaz they are onli teenag while i didn't know what i had done in my teenag in china mayb onli did the test day by day
379,how suck we were
380,also their pronunci of english is so beauti i'm so envi it
381,yeah it' crash on me a lot too
382,thi is so true you have to have the faith
383,sometim it is hard to rememb that
384,it is there for sure
385,hmm wow thi is the next step toward ai i think have you seen the movi i am legend
386,thi is how it start
387,we cook them their final breakfast on the 20th look forward to hear their stori
388,pomona kiwani we rock
389,actual i had a nice ass ye
390,ye you did
391,great superb info thank for share
392,an excel speaker who deliv a factual and object ted talk
393,well done
394,i agre it' time for us to inform ourselv of the truth by seek answer and not mere accept them
395,no problem
396,and thank for all the prop
397,what a big expens for the public
398,if u have a minut boo listen
399,thi put a smile on my face nitra ne' harri
400,i love thi trickster is rampant in southern folklor and is tracedd back to africa
401,emili is now one of my favorit humorist join jon stewart and tina fey
402,keep up the great work thi is awesom
403,just wish i wa closer and could come join a dig in and plant some shit with you
404,great organ you love fabul congresswoman chu felix navidad
405,as a longtim now retir educ hear hear
406,you make me laugh so hard
407,so glad you'r better back the uso
408,haha xd got ya
409,zombi protagonist and sequel possibl good luck
410,great
411,there' no substitut for see it in action
412,haha thank
413,they were the tamest of the bunch colourwis
414,no problem
415,i figur i should start follow back sinc you hit level 30
416,happi holiday to you
417,we are inde fortun to have you as our repres
418,congratul to rep esti and mani thank for her support of equal treatment under the law one of our most import and valu constitut right
419,make me nauseou to think of the sacrific those folk made and to see where our countri is today
420,great idea
421,i'v sent on to the depart of transport in the uk too at least someon there know about it now
422,dude all the websit i went to were worthless except googl you damn heathen
423,hang on in there pgood luck with them
424,shalom semat gillibrand and all my jewish friend
425,way to be work on our deficit debt crisi
426,get your photo opportunist butt back to washington and get the work done
427,thank u for follow me back d
428,that make more sens i read feet of clay mumbl year ago
429,thank
430,all truth sir
431,thank you
432,thank you a lot
433,it wa amaz
434,i as a man am veri veri boner
435,great content
436,i'm seek support for a panel of relat matter at sxsw interact march of 2011
437,if you'r interest place your vote here http panelpick sxsw com idea view 7068
438,onli 200 of over 2 000 panel get chosen
439,winner are base on vote
440,thank you
441,support hr38
442,thi is our chanc let' get it done
443,awesom preset
444,in my age of 27 i believ i still have chanc to be creativ
445,thank you ken
446,good let us all follow it
447,wow fantast talk
448,what an amaz woman
449,thank you for stand up again chelli
450,i am pray for cong
451,gifford
452,sever
453,own
454,here
455,are
456,just
457,don't
458,have
459,anyth
460,better
461,than
462,to
463,put
464,someon
465,down even
466,you
467,don't
468,them
469,if you
470,don't like
471,him
472,turn
473,off
474,or
475,just
476,don't
477,wtch
478,him
479,i
480,person
481,think
482,he
483,is
484,great
485,i don't think ass cramp are someth to poke fun at
486,so grate
487,never expect it even though it our
488,3 6 will pay my hmsa premium if live under 400 of poverti the cola keep us there yeah
489,the fed are hedgefund 1 5
490,it show
491,he look and move better for it
492,thi perform is stun
493,thank you
494,that' some good stuff you'r do in your pp
495,much respect
496,thank for the fb
497,ye i do
498,i play in an adult leagu thi spring and plan to play some pick up game over the summer
499,wish i coulda been there b
500,wish we had it in australia as well
501,follow
502,thank for the mention
503,after watch the video i thought that some of her experi wa interest and that everybodi make differ choic
504,i wa wonder what we look at when we tri to make the best choic
505,like how we make the best decis and is the decis from heart or head
506,can't wait till episod 9 watch 8 on demand too mani time and end up with the same facial express stare at the tv mouth open like the wow emoji and shake my head say mac done lost hi ever love mind
507,thank doubl l nice to meet you
508,that' all good and fine beauti done
509,i have op tag as perf
510,loop
511,ye he doe need a babysitt
512,i don't think the babysitt dress him for thi photo
513,thank for the tip just order some
514,im realli tire of donald trump alway someth to say about other
515,dont you think if the presid wa born in kenya we would know
516,i mean they have to check all document
517,come on we have better thing to deal with than thi issu
518,hmmm govern shut down
519,the slow stream time is kill me it stop to buffer 2x dure the open
520,thi short video emphas import of use a good bodi languag
521,accord to thi video use a good bodi languag can chang the one person' first impress
522,therefor we have to use a bodi languag well and properli to give a good first impress to mani peopl
523,i knew i saw you
524,enjoy your weekend senat murkowski
525,oh and happi bday
526,sticker
527,i'm sorri but nlp research have known and have been appli these principl for decad
528,so tell me if you think aca obamacar is bad whi do you think the exchang in ryan' voucher plan won't have the same issu
529,congratul
530,keep up your great work
531,it a common fuck decenc
532,it the right to be heard
533,you'r in lousyana good job be a defens driver
534,stay safe
535,wow if thi get back to day she is go to flip out
536,wa he say thi to anyon specif or just talk to the camera
537,i'm from nelson
538,hubbi from tauranga
539,what about you
540,i'll be sure to tune in
541,good luck
542,i second what you said
543,ive vote on both side and im veri disappoint with both side
544,we need a firm hand in the whitehous with abil to compromis
545,im a veri proud american
546,as your presid put thousand of sexual assault crimin back on our nation street
547,what a hypocrit
548,great perform toni
549,i find it perfect
550,so ador
551,congrat and happi birthday
552,i guess
553,i work at a theatr compani where i made the set
554,although the first day they didnt realis that and had me audit for some of the part lol
555,go madison
556,you can do it
557,whoo hoo
558,go get some gold
559,i cri
560,realli move
561,we are all amaz creatur fill with love
562,thank
563,great appreci
564,i find it scari that at a time when the most promin conflict are root in the the greed for fossil fuel there is a promin explor who want to take thi into space
565,what he ha done is brave and admir but to dress thi propos in the same cloak is frighten
566,and thank you for the follow back
567,good luck on the rest of the season
568,you should not wear the american flag on your head js
569,new in murrieta but big republican support
570,may the most high continu to bless thi breddren
571,and may hi messag be carri to the poor the forgotten the afrikan
572,ash
573,amen
574,selah
575,one love bless
576,thank for follow me back
577,thank you for your kind word
578,my dress make me happi so i hope i do them as well
579,look like elis is support trump
580,oh no she must have miss the memo from her puppet master paul ryan
581,someone' in for a talk to today http www pressrepublican com news local_new north countri gop support for trump build article_0eda0c60 6281 5b53 a136 e0788d922b1c html
582,just tri to return all the prop you'v been give me late _ yup onli got about a month left and then it' summer break
583,anthem blue cross want a 14 hike when their first quarter of 2010 they made 877 million up 51 from a year ago and they gave their ceo angela brali a 51 rais to 13 1 million help
584,thank congresswoman matsui for all you do for all the peopl of california
585,so veri well put
586,beauti
587,the true heart of diplomaci is kind
588,wow awesom work and awesom technolog
589,ye
590,we must do someth to stop the piraci by credit card compani
591,they'r killin us with arbitrari interest rate hike
592,agre with your middl east assess express on mtp today thank you for your servic
593,howev you damn well pleas
594,or dont
595,i dont own you
596,oh we can just kiss that good bye if those republican nutjob get into offic
597,i think it is veri stupid to say peopl will accus the doctor if he dont look friendli
