,sentences
12898,now that you realize you're wrong be you go to actually do something about it
12899,highly doubtful
12900,you've finally make it brah
12901,so good i sell my kettlebells and buy another one
12902,it turn out i'm an absolute natural
12903,d
12904,obey's yes vote on healthcare sean duffy s election to the house of representative
12905,at least one good thing will come out of it
12906,keep fighting for our freedom
12907,mp always give a good interview
12908,thanks for do casino on apr 2
12909,joe heck be a liar own and operate by the nra and insurance lobby and love that kock sucker money
12910,i would recommend that people interested in this topic read two book that will enlighten many of the reality of food production put in the context of history
12911,these be the alchemy of air thomas hager and dirt david r montgomery
12912,i be literally yell this at my phone last night to a got damn zubat
12913,haha
12914,what be the move sculpture with the chair be pick up and put down call
12915,that be beautiful
12916,yay for useful practical presi's
12917,d
12918,ben you make even sing happy birthday beautiful
12919,i love watch the expression on the audience members' face
12920,they be absolutely captivate by your humor your expression your music and your word
12921,you be an entire orchestra by yourself
12922,the best education be experience
12923,gotta love hillary our next potus
12924,one of my favorite ted talk
12925,help inspire this article on how a barbie doll help me teach my daughter grit
12926,http therecreationalist com how barbie taught my daughter grit
12927,brag about an epic failure again to do the one important job you and your colleague have
12928,you should be embarrass
12929,this be an excellent talk
12930,i have always be fascinate by ant and every summer i find myself mesmerize by their haphazard interaction
12931,this be the first time i've actually hear about the queen and how they start a new colony
12932,very cool research
12933,thank you
12934,cool stuff
12935,like the theory seem to make sense
12936,not that i belive in a god that create us we be just a coincidence even in a single verse
12937,still what put this ursuppe there in the first place that allow all these universe to be create
12938,one of the most incredible lecture
12939,morning like this i feel like i've be run over
12940,sorry i wasn't there fred
12941,i'm in flagtaff az where our daughter life
12942,heard you get zinged a few time all in fun
12943,i appreciate your dedication to help the us get better
12944,thank you ashlee watkins let hope a healthy dialogue can start
12945,welcome to fitocracy
12946,thanks for the follow and if you have any question about this site please feel free to ask
12947,good luck
12948,also gotta get your about me section fill out
12949,let people know what your about and what you wanna achieve
12950,i way almost a goner at age 6 month now i be age 60 in august a only son
12951,no problem
12952,and thanks for the prop
12953,i'm really like this site very fluid and easy to catch on
12954,d
12955,good job he play really well happy to see isner play a great match
12956,he be my favourite player
12957,should have be fire a long time ago
12958,we all know he be dirty
12959,now let him pay for his action
12960,pink be a pretty color for him
12961,this talk remind me to be grateful that while my country be not perfect there be still many good thing go for me
12962,i be thankful
12963,please sir
12964,we have ask many time for you to cosponsor h re 752
12965,we have 159 cosponsors now so say yes and join your fellow congressman
12966,thankyou
12967,saw both game michigan win way to go
12968,good
12969,i hope you support regime change in iran
12970,reek it rhyme with leek
12971,thanks diana for share this experience
12972,it teach me wht to focus in life
12973,yes i've be ready since i first hear about it
12974,i'm always ready for a new dean koontz book
12975,come to seattle for comedy alonzo
12976,we miss you
12977,i'm get a stand up desk in a couple of week as part of an office remodel it might sound crazy but thats the one thing i'm most excited about
12978,i think this be one of the most beautiful talk that i have listen to on ted
12979,amaze
12980,i like how u speak ur mind and tell the truth
12981,condolence to the family's
12982,baby could have accidentally catch an axe and throw it into the camera man
12983,that would suck
12984,welcome to my side of the world
12985,nobody live there because its frigging cold
12986,cute but grow up you change into drop dead gorgeous
12987,its possible
12988,i just think that its ridiculous that people be so sue happy
12989,the family of the shooter be probably just as upset by the tragedy as the family of the victim
12990,i feel profoundly move and change by jill's talk
12991,i both laugh out loud at her recount it what a natural story teller she make if only all motivational speaker be as interesting and be move to tear with her at the end of it
12992,thank you jill for share your amazing story
12993,you speech be so great as we know the economic condition of china be much improve this year but now the way of developed economy be go hard and harder yeah as a chinese hope china will grow stronger
12994,thank you my darling friend
12995,xoxox
12996,lol well keep me in mind if the fight ever happen
12997,i always dig a nice reddit mma bet
12998,selfie video in general weird if youre not the subject of the video
12999,hey check this cool stuff out but im obsess with myself so heres my face too
13000,glad too see your in washington do your job which be basically nothing
13001,if you dismiss bill o'reilly i will no longer watch your channel
13002,i work during the day and your pm line up be where i get my real news
13003,again if bill o'reilly be fire i'm do with fox news channel
13004,long time ago i also have to go through this good luck
13005,why so beautiful louisa chirico
13006,where's my invitee
13007,semper fi lady great job and much success in the future
13008,congrats
13009,hope you do great thing in congress
13010,you'll get there
13011,you're take graduate level pole dance class now
13012,they're probably concern about have their million dollar salary reduce now that health care be attainable for all american
13013,and see all the slacker at work
13014,right hemisphere we inside the me
13015,left hemisphere me inside the we
13016,all in one and one in all
13017,they both make our life beautiful
13018,it be important that all of us take responsibility for ourselves and our problem that we quit the current overspending nonsense and that we quit put massive debt on baby who won't even be bear for decade
13019,i repeat please get rid of this massive and harmful spending
13020,yeah i be wonder on how the muscle would change with the increase endurance
13021,thanks
13022,p s
13023,she have blonde and black and grey and blue hair
13024,i think that's kinda cool
13025,this be truly awesome talk
13026,about to join the 50 so inspired by your sled trainer photo
13027,have to follow
13028,i didn't doubt that for a minute
13029,accord to his girlfriend sister twitter what a credible source
13030,thanks for the follow back
13031,i'm sure they'll recover fine
13032,great workout by the way
13033,united state of space
13034,congrats jessica
13035,trailer look great
13036,let's trust north korea as they be not a nation of terrorism say the present us united nation rep mrs rice who own how many share in the canadian pipeline
13037,happy thanksgiving to you too david
13038,professor benjamin be amaze
13039,i'm be very glad to have the opportunity to learn from him at harvey mudd college
13040,it's her time now
13041,rank 205 a few month ago and now in the top 50 with this win
13042,i miss chat with you in the newsroom whenever you pop in
13043,have a great interview today
13044,i really can't believe tat it isn't prerecord gr8 work
13045,welcome in the group don't forget to share in the group you fav flavor
13046,just find out you vote in a separate action to strip the birth control benefit from the affordable care act
13047,really ann you need to stay out of our womb and our bedroom
13048,thank you congresswoman bass
13049,keep up the great work
13050,everyone endorse your candidacy
13051,you're the absolute best
13052,thank you congressman
13053,oh no evah what happen how do you hurt yourself
13054,i hope you get better soon
13055,i agree stephen be really funny with some comeback his stage cocky ness there be a few gem but a lot of time im actually more interested in what the guest have to say
13056,you're most welcome
13057,and yeah i'm post on 4 month old status update
13058,congrats always to patty
13059,she represent the people of wa as do my buddy scoop jackson
13060,george i respectfully refer you to 1 on this postal service fact list sir
13061,http about usps com who we be postal fact top 10 thing to know htm
13062,vote cast in your direction
13063,why be you still here
13064,i think you have create your own uk politics subreddit
13065,with blackjack and hooker
13066,our company prepair to offer the cost price for this project so people can get a pure electric car below 18 000usd range of 250km fully charge time only 25 minute battery cycle life be 2400 cycle that mean 0 037usd per km
13067,i just message you like a week two ago
13068,couldn't poke your head in there
13069,jk
13070,i appreciate it i'm alright
13071,what's new with you
13072,thank's for your time today
13073,we really enjoy speak with you
13074,where i have a choice to play field hockey or intra mural my daughter have play any sport that interest them and go as far with it as they want
13075,it's time for a title ix program for gender equity in all area of our life
13076,go title ix
13077,i love this idea
13078,join
13079,that make sense
13080,i know the first three be very close like within a week
13081,didnt remember im2 in so close too
13082,that would make sense
13083,but with homecoming shift time for everything do it really matter anymore be the question haha
13084,thats another story altogether
13085,this be so brilliant
13086,i love her
13087,will share this site
13088,coms to st louis lhhh
13089,m gilbert's talk inspire me to write this essay http www torahdinner com etone p 232
13090,thank you for be my muse of the moment
13091,leon
13092,love your hair bethanie
13093,link data be a good idea but equally important be link understand
13094,tbl mention data standard and standard format but he do not mention standard for metadata or documentation
13095,the international community be way ahead on this
13096,can the u s catch up
13097,thanks debbie
13098,happy and healthy new year to you too
13099,you be such a winner
13100,hug
13101,randy and rube www facebook com massrandall
13102,with the right soil this be another great agricultural alternative crop for florida and the florida farmer
13103,i love this talk
13104,i have also write a book on the subject call agile kid publish in 2010 introduce agile into our family step by step in a practical manner
13105,enjoy shirly ronen harel
13106,thanks man
13107,just get back from a quick bike
13108,i use to always smoke and then work out and i be never a unhealthy munchie eater
13109,but now i drink and drunk awesome roy eats fatty food and sleep
13110,i just cant wait till i can smoke again
13111,until then ill just stay on this bike
13112,el color negro te cae perfecto
13113,yeah
13114,one of the most interesting talk in ted
13115,womanindota 2014 11 07 03 43 utc faceless void we see ur vagina beled to death this message be create by a bot contact creator source code
13116,i think that ribbon in the background be liike meant against her
13117,too bad california you have big problem and still vote the same screw up in
13118,insanity
13119,make me want to learn chinese we the west need to reconnect with china on a personal 1 to 1 relationship way
13120,while we still can
13121,the cyber attack and build up of military be all the warning we should need my clan
13122,ben ben zu
13123,haha def deserve that appreciate the follow as well
13124,haha may bad well thanks for be so helpful
13125,i can now make some appropriate changea to my diet and lifestyle
13126,hmmm n and s korea
13127,i'm just wonder who start this divide and rule strategy in the first place
13128,china
13129,impossible
13130,all of these pipeline be go to take bitumen dilbit actually even more toxic than crude to 'tidewater' where they will dump it onto oil tanker that will take it down to the gulf for refining
13131,none of it be for use in canada or for refining in canada
13132,you have a show that last more then 1 season
13133,no way
13134,lol lol
13135,kid i be look forward to it
13136,im still pull a nice 80k on target dummy
13137,i love this idea
13138,would love to know more how to start build one
13139,the idea of fresh live food totally appeal help guard against food waste go off and the reduced impact on the environment
13140,chick flick become popular among woman not because they be lame stereotype of woman but because woman really do want chick flick
13141,how would the domination of social medium by woman change that
13142,will it change what they want
13143,i like the way you check thing out matt
13144,you be do a great job
13145,include the community and surround area be a very good thing
13146,help to get good feedback
13147,help make your job easier and serve the people fairly
13148,you should go back for the fandango
13149,its a lot of fun
13150,i will say your adventure give lot of idea
13151,marvelous photo
13152,when conservative like you win we all win
13153,go steve go
13154,watch season 10 marathon great episode
13155,love you as a demon in the begin your hair look great but u scar me with the mark cause you just didn't care anyone or yourself
13156,glad to see you back
13157,whew
13158,you be one good look man
13159,awwwwh
13160,thank u
13161,u too
13162,u too
13163,you're very welcome
13164,thanks for the reminder
13165,just shoot myself an email don't wanna mess with this web browser anymore today
13166,glad to help
13167,i be not optimistic that most people will get the gist of this talk
13168,thank you
13169,and thanks much for the follow
13170,tammy why don't you help us with the crime go on in our legislator
13171,they be try to cover up all walker illegal doings and stop veteran and college student from vote
13172,keith ask the state to establish a money for muslims program so they wouldn't be attract to radical islam right after 22 of them somali's defect and join them
13173,this be typical of dems solve problem with buyout money and come from someone who doesn't have a clue what assimilate mean
13174,hola
13175,jugando a ser grandes
13176,que bien
13177,dunia te imagino ahi jugueteando con ellas amorosa y linda como mam
13178,deseo pas un bonito y maravilloso domingo llenisimo de amor
13179,angelitos bellos
13180,law enforcer put people life on the line everyday to protect their job gang member with badge
13181,you win inane comment of the day
13182,inane as fuck man
13183,oh geez
13184,hardly a legend but certainly an old timer lol
13185,i be on fito when it be uphill to school both way
13186,i love make new friend here and find way to keep inspired
13187,the honour be mine
13188,watch it this morning but hey it's the bryan bros so they're basically unbeatable at double
13189,rock that hair do in wimby
13190,you go bms
13191,damn i want to see this
13192,awesome job josh what be it like to film
13193,you still kill it dude
13194,of course motivation
13195,an excellent speech captivating and informative
13196,thanks for the follow back
13197,yeah fitocracy seem more biased towards strength training
13198,i think their point system need a complete overhaul
13199,you make us all very proud
13200,keep up the hard work it's pay off in your performance
13201,people like you truly disgust me
13202,elfin forest in north county san diego amaaaazing hike
13203,american idol judge super star legend paula abdul you rockedthe world with cool r'n'b stuff late early 90's such as straight up opposite attract my love be real cold hearted blowing kiss in the wind rush rush
13204,one of the very few rapidly dwindle politician
13205,i think this video be very good
13206,i be go to share this video and i hope if find that right person that need it
13207,for what i do right now in get people to read again in my city this video be something to keep me motivate on my goal
13208,vote for debbie gary and mark
13209,can you believe it
13210,dinner at the white house the house build by african slave i'm sooooo proud of you potus and the cbc
13211,ive already see a ton of cardinal fan around town and i dont even live near wrigley
13212,its gonna be crazy
13213,if she can't get bill through to help louisiana voter what good be she
13214,i be now watch and thank you for actually read my post
13215,like the option to block invite from a give person after they invite you so many time in a row kind of like the option to boot a player after so many betrayal be in a lot of game
13216,or the option to turn off incoming invitation entirely maybe
13217,thank you rep pingree
13218,finally we have someone represent maine with the common sense we mainer expect from our elect official
13219,great ted talk
13220,i agree with his comment
13221,great job congressman johnson
13222,elegant
13223,stun
13224,this be a look that command respect
13225,amazing talk
13226,inspire a lot
13227,i couldn't avoid cry in the end
13228,i can
13229,we can
13230,self efficacy that's quite a profound concept
13231,i'll give you a great cheat week
13232,wow this be so powerful and bring me to tear just watch it
13233,because i too be face of m s
13234,and i have always say that i have m s
13235,but m s
13236,doesn't have me
13237,chromosomonal link in lol
13238,come to minneapolis
13239,we love you here
13240,wow that just convince me that idea that may sound a bit too unlikely to implement in the first place be actually worth while
13241,no small feat
13242,good work thanks amy
13243,so pulse be more underused than tachanka
13244,okay
13245,can't wait
13246,go eve go
13247,no problem
13248,good to see we're both put in the hard work
13249,i like them both too i be a big fan of mathilda in echo a shame shes not well in hero but i believe i can make her work
13250,do they occur in nature
13251,if not then don't eat them
13252,to gym
13253,you'll feel well when ya do
13254,work the sore muscle
13255,aloha brian
13256,but not with toxic dangerous geothermal geothermal fracking right
13257,no on syria no on gmo pesticide poisoning of hawai'i
13258,no problem i sure will
13259,d
13260,off the wall and brilliant as usual from rives
13261,bravo
13262,i'm so excited for this
13263,great idea
13264,great goal
13265,great person
13266,internet wont solve the problem in the world although internet be the tool we can use to share our problem and together find the solution
13267,let work together to make this world connect
13268,let work together to make this world a better world
13269,happy friday lourdes
13270,have a great time visit with you tonight
13271,yeah and what about obamacare
13272,do anything to repeal it
13273,didn't think so
13274,why would it be austin change shit
13275,this be my favourite workout programme ever
13276,listen to your customer
13277,mwwahaha aspetta che ricomincio come si deve a correre
13278,im clearly in the minority and i get that
13279,i still lurk there a lot
13280,ok mr dee
13281,you've convince me i need a new o
13282,i'll install penguin's
13283,seriously now we get to abandon the idea of humanity be above the animal
13284,we be on the same boat
13285,what happen to them will happen to us
13286,i enjoy this
13287,love that he have not stray from pb
13288,wahooo awesome beauty 3
13289,a solution in search of a problem
13290,be you serious
13291,of course a voter id law would suppress turn out
13292,if you've have people who can't prove who they say they be why would they show up to vote
13293,marsha it would be comfort if he would keep the strength and power of our armed service
13294,love it once again
13295,no problem
13296,thanks for follow back
13297,good win it be nice see u here in jamaica make sure to come back next year
13298,bad skeletal joke give me a femur
13299,zoe
13300,you be an example of dedication and courage
13301,thank you
13302,do we really need 8 separate post about this
13303,great talk monica with such a timely and important message
13304,have share it with my group of 15 year old girl guide i think they especially could benefit from your message on the power of compassion online and our responsibility not right of free speech
13305,hope they will all become upstanders
13306,vote for you and ms landrieu today as well
13307,best of luck to both of you
13308,halperin you're such a right wing tool
13309,wcw you be beautiful
13310,of course
13311,to be the best you have to be really hardworking
13312,really pete defend black panther
13313,try say the biased comment al sharpton say to defend white you will be off the air
13314,when i do i get call a troll
13315,please help lee zeldin in any way that you can
13316,not only be lee the right man to represent us in the ny state senate he be the best man to represent us
13317,very interesting
13318,most difficult problem have simple solution
13319,nancy we love you all the best ''you will be on your speaker seat after the 2016 god bless you
13320,congratulation soror
13321,keep up the great work
13322,squat heavy but squat safe
13323,congratulation to benson
13324,good luck to you and the canyon del oro h tucson academic decathlon team at national in april
13325,yeah but we do know what she say he end with
13326,yes
13327,all my friend and family some do not get it and others do
13328,deepest sympathy to his family and friends prayer
13329,so glad u r have such wondeful experience
13330,you shouldnt submerge a fresh tattoo
13331,log it as something similar like log press i think that's what it be anyway or ask for help in the forum https www fitocracy com forum or ask the people in the strongman group https www fitocracy com group 538 about
13332,lourdes duarte i saw this beautiful story
13333,truly amazing and sad at the same time
13334,you do a wonderful job on this
13335,thank you
13336,chill just insane
13337,the whole story
13338,hello
13339,yay choconess
13340,time to get down to business
13341,now let's do this
13342,o
13343,monica as a nursing grad you should definitely attend this health forum
13344,i wish cmr could attend it too
13345,it should be require of every elect official and every health care worker in the area
13346,http www2 providence org spokane news news release page tr reid forum aspx
13347,you're do great vania
13348,keep it up
13349,look forward to see you play at the u s open again later this year
13350,when will you finish ride the storm
13351,we're all wait for christopher snow
13352,compromise
13353,stop blaming each other and try something that work
13354,already do i know who be good fot us
13355,just level up
13356,back in the game
13357,respect sir i be an kashmiri pandit from jammu and kashmir just want to say a big thanks to u for ur effort for introduce resolution on kashmiri pandits in us house of representative
13358,definately i'll be tune
13359,gd luck
13360,i don't see your name on the list of lawmaker who will not attend the inauguration
13361,how you can support this man be mind boggle
13362,what a disappointment
13363,congratulation to you and lucy
13364,it be amaze match
13365,i can so relate to this speech but be she from scandinavia
13366,she be talk abt other people's doubt in you jelousy and envy typically swedish
13367,i didn't think american would say that
13368,congrats elizabeth this doming book be a success as all your book will be
13369,i so wish he would move to kentucky congrats again maine
13370,lose respect for you mark
13371,hillary be not capable of leadership nor of foreign policy direction
13372,you're too great jane
13373,hopefully you'll be able to come back for the us open i'll be cross my finger
13374,good luck b
13375,and you know effectively bankrupt the state
13376,well yours be actually crumble
13377,om just get push out
13378,oh i would love that
13379,it take me and dad many run before we find our groove
13380,of course dad be nice and let me stop whenever i want to
13381,what kind of dog be gambit
13382,rep lofgren please read this well think out post and think of way to improve your propose aaron law http www volokh com 2013 01 16 the criminal charge against aaron swartz part 2 prosecutorial discretion
13383,dear janet i like your story and artwork so much
13384,especially the amazing public art installation 1 26 project
13385,really hope that it could be adapt in shanghai the city where i live now
13386,you're welcome _ glad you follow back eh
13387,hmm
13388,not long ago i heard of equally liquid repellent coat be in development by the condiment industry for item like ketchup bottle i wonder if it be the same stuff
13389,muhammad ali be truly the greatest of all time
13390,i feel confident he be in a better place for all of the contribution he make to society both inside and outside of the ring
13391,i miss you champ
13392,thank you and for the follow back look forward to see your progress
13393,thank you
13394,you too
13395,kick as
