,sentences
0,i don't think any one there have ebola bob latta you should be back in washington actually get something do there on the house floor
1,anything other than jean and t shirt be superfluous by the way
2,'update your wardrobe' pfft
3,meh i could only get to 8
4,need to work up
5,a bill consist of a single sentence
6,very well do sir
7,so far so good
8,thx
9,my buddy jeff johnson be your prop master on that
10,she have me at everlasting youth
11,congratulation to you for a well deserve recognition
12,baffoon idiot dumb
13,the intelegent conversation continue
14,they don't deserve that honour stupid hollywood movie business people
15,yawn
16,be this honestly news
17,same to you brotha
18,get at it
19,would good to know how the age of all of these thing have be measure
20,the perfect society be shape in the form of a pyramid the old at the top and the young at the bottom support the old
21,if we kill off the young that will take care of us with thier s s tax we will have no support
22,this be the reason social security be fail
23,so genuine
24,so true
25,so good and love
26,thank you
27,i be so totally go to try and make this one
28,thanks for the reminder
29,be on holiday in nz a year ago amazing place
30,yeah i recognize you as a mod
31,funny that be have 2 convos in 2 different place in the same thread
32,damn straight
33,now let get our main lead and the good female director
34,god bless the child and their family's amen
35,my grandfather have a garden and one of my greatest memory of childhood be have fresh carrot
36,he would pull them straight from the soil wash it off and i would sit and enjoy
37,i still garden to this day
38,thanks for the 4th of july wish and for all you do for texas
39,do u jerk off when u get back to ur car or do u manage to wait until u get home
40,i would like to volunteer to help in your campaign headquarters
41,i twitter this
42,i find it very excellent and insightful
43,i only could watch half of it because i be relate kind of how my life be now
44,i hope to watch the other half or hear from you soon
45,be there a black and a white area
46,we will miss you
47,i think speaker perez marry my sister
48,ha small world
49,boss be not try to make decision for woman
50,they can make their own decision
51,they'll just have to pay for that decision
52,keep your legs shut or have him wear protection duh
53,the foreign exchange restaurant support local family own minority business
54,incredible
55,thank you amy cuddy
56,i really need this
57,they be scar to confront him
58,they be fail to follow their swear oath to protect and defend the constitution
59,what remedy do we have other than vote them out
60,november may be too late
61,a pumpkin sitting on a pumpkin lmbo
62,sheesh way to put the pressure on guy
63,i guess if you put it that way then sure
64,where would you like to have this friendly discussion
65,here ok
66,thank you may el khalil you be heroic
67,by bring normalcy and peace to lebanese people you spread it to all people everywhere
68,thank you also to ted talk for provide a forum for showcasing great idea and the great people who dream them so the rest of us can benefit
69,with pleasure
70,thanks for your support
71,go congressman
72,just toss some old history book out the window
73,it sure get my attention
74,thank you so much
75,please
76,i need more grimm
77,please support congresswoman lowey by follow her campaign account on twitter
78,it's because i basically propose marriage to you and you didn't say yes i'm just a little heartbroken over here
79,let count all the crooked politician in the room
80,i see a judge
81,there's a councilman
82,da
83,state senator
84,awesome
85,i never have a doubt
86,hope you'll be do something like this in brunswick county
87,let me know if i can help
88,d i'm more of a happyhyena than a pirahna my old nick
89,http www youtube com watch v uncwmax8cs
90,thanks
91,i be close to get many achievement without even know it so i write down what i need to do to get a bunch of them the last few day
92,it be a fun change of pace
93,i be feel pretty great
94,today be my first food cheat day in almost 5 week
95,lol
96,thank you lord jesus for our men and woman who serve their country and their fellow man faithfully
97,amen
98,raw milk have substantially the same nutrition and shouldnt be recommend to unacclimated child
99,hi paula
100,i'm honor
101,your tweet and dm's certainly make my day too
102,oh what fun
103,be you follow april
104,awesome article eric
105,so happy for you
106,i just don't believe you
107,not one inch
108,you may give people 8 minute plus but you just waste 19 minute of my time
109,ya hit the nail on the head tom
110,thanks for the follow back
111,you be go to hell ed
112,i can't repost this but i want to
113,you should start log on more often nomsayin
114,tim scott run as tea party candidate back in 2008 i believe
115,thank god for nikki haley for appoint him
116,i really doubt the pipe be glow
117,with wisdom and grace guiding you bonnie go forth and do great thing
118,fascinate talk
119,will never look at spider web in the same way wow
120,i hope you say beforehand hey jude don't make it bad
121,why thank you
122,not as smokin as yours though
123,how about restore our civil right obama just sign away
124,more than you know
125,2 3 ow but this advocate sorry for any others respond on a phone be difficult sometimes
126,good luck speaking
127,you will be love because you perpetuat
128,yes american with concealed carry permit be role model
129,hahaha what'd you play as thanks for the fb
130,the micro organism be find in wetland and marsh
131,what can't wetland do
132,every event be important you need to stay more focused and forget about social medium
133,have so much fun work on that movie
134,saw it with deon roxanne and others tonight in sac
135,bresha webb
136,linda s clay do you listen to the 911 call any good marine know land navigation
137,commit to make sure we don't lose our healthcare
138,how
139,specifically how
140,you're welcome
141,i'm sure there will be many more to come
142,no problem i've attempt nearly every sport there be in the book
143,soror marcia so proud so proud of you and your work
144,keep do what god have you to do
145,pretty your fan be so thankful that she have you
146,the bay area have its best weather in september
147,i believe in you tammy you're great
148,obama administration be hard at work for everyone but american citizen
149,these video make up for the lost time i watch stupid video on youtube
150,no worry and thanks for the followback
151,dancing be good
152,this ted talk move me and make me reassess my life
153,i pledge to be more compassionate and to be more aware of the countless thing i ought to be grateful for
154,i wish i could wake up that early haha
155,i've be pretty off track myself and now my leg be stupid
156,but do physio for that now
157,other than that thing be mostly rockin' i hope your summer be rad other than the fall off
158,hahah you and your manly weight
159,not anymore they dont tbh im happy about the col bandwagon
160,they deserve it
161,clinton be very hansome
162,this be so adorable
163,thanks for back this up with some industry knowledge i dont actually know much about market but the marketing guy who ive interact with through work always do so much more than just manage advertising
164,the reason be simple social democrat have abandon their principle
165,two beautiful woman
166,sad it take a tragedy to get people to be nice sigh
167,cygna ruin healthspring when it aquired it
168,rachael ray be such a nasty person why send her down there
169,i miss you too
170,glad you be smangin your workout
171,god bless all that be respond to the fire
172,after watch this talk i think i'm go to wipe the dust off my copy of wikinomics
173,it have truly spark my interest in this topic again
174,thank you chelliepingree for stand up for maine people
175,i believe in her declaration of common ground for humanity
176,bryant i can see why a conservative like you would be shock and disgust by a member of congress actually try to help people in his district
177,yes we're go to revolutionize processor technology with vaguely word africa magic
178,the 300x300 pixel cartoon of cpu be very convince
179,thank you
180,i have be pray for his release
181,amaze
182,thanks for the follow back
183,a great experience for you shelby
184,sabine have one of the toughest serf on the tour
185,hug to you honey
186,i didn't want to go too crazy today because tomorrow be gonna be a lot of heavy olympic lift so i decide to blow up some of the easy quest
187,happy halloween for all beautiful grimm
188,congrats tony
189,you rate an a with this teacher
190,sooo excite and happy for you eric
191,yaaa varv
192,great job
193,yay
194,soooo happy to see this post
195,avoid the chocolate
196,they still have not answer the important question
197,please do not let this go away until they answer who call the stand down and why do they call it
198,great idea
199,early adopt might have some issue but will be a great way to solve traffic issue
200,thanks mate
201,hah
202,yes day by day s
203,we look forward to see you in chanute again
204,yea
205,enjoy it for me
206,i'm stick in montana
207,not even my childhood fantasy be this exciting
208,and the potentiality of such thinking i cannot even imagine
209,yes the future be go to be very much different and well in so many way
210,sound good to me
211,when you transfer
212,haha
213,you earn it great work
214,thanks for this post
215,watch home right now its never too late to change
216,awareness brings change
217,you have excellent commentary
218,i be a very proud constituent
219,9 1 1 be literally a lifeline
220,it be not a waste of time
221,thank you anna
222,if you wanna keep your job you better work towards 9 11 truth and end the federal reserve or you'll be fire in the come year
223,how can you celebrate a history which have enslave the brother of black color and all other people of color for that matter we do not celebrate but remember the atrocity by those who come to this land but to destroy it
224,good for ken what be he do about create job for the unemployed american citizen
225,haha thanks
226,i know they dominate my face
227,directly below this post should be a post that start out
228,21 gun for 22 vet
229,it get delete from 95 of all government official page and i hit them all
230,if it be not there it be because cannabis threatens someone bank roll
231,here be your sign
232,exactly
233,we be responsbile businesspeople
234,not every dollar make by a business be an attack on the world
235,just against white people who pay for high price football game which in turn put a big check in his bank account
236,bite the hand that feed you
237,well way to make your point
238,you be act disrespectful and that be what you will get in return
239,wise up
240,worse appolgies for the typo
241,cute as ever mr sapalishous
242,lol
243,he'd bounce a lot more than me
244,you're welcome and thank you
245,stop voting for your party and start voting for the people who put you in office
246,thought and prayer to everyone
247,wish you much success bro
248,i find myself come back and back to this talk which be one of the most inspiring i've ever hear
249,sir ken robinson be fascinate spot on and very funny
250,i wish more educator listen to him
251,i recommend his book out of our mind learn to be creative
252,i need this video today
253,thank you for help nominate the weakest possible candidate against trump
254,d
255,if you support the progressive democrat party you be also support anti semitism
256,thanks for all your support guy 4 more hard session to go so still some work to do
257,but you still support that unstable rat you call a president
258,until now though ed sheeran have basically only be know for sing
259,he also top 10 most popular singer in the world right now
260,stop be deliberately obtuse
261,so happy for all you have accomplish so far
262,love this place on vacation
263,i've never hear so many negative campaign commercial from the liberal camp in my life
264,they don't want to let go it's a lost cause for them and they have yet to realize this
265,they werent wear their hi vis though tut tut
266,glad to see you be with the democrat and the president
267,glad to see we still have some competent people leave
268,great job
269,who care about the yank its how it affect our security im worry about
270,theyre not the friendliest nation to us afterall
271,great quote thank you trent for stand true to your belief
272,i always cheer when i hear that you've get reelect
273,ive no doubt that it would be heaven to be in either or both
274,good motivation right there
275,that's disrespectful trifling smdh
276,yes and canada's president welcome all our refugee and illegal immigrant to canada
277,he want for canada what trump be try to prevent in the usa
278,very good talk
279,i wonder what have be do to try to breed super spider
280,spider with bigger and bigger silk gland
281,happy fourth of july to you and family
282,best way to save the planet be to start get our energy and strategic material from space
283,it's all out there space be the place and it's closer than some might think
284,because it's what complete idiot like yourself drake say when you've just realize you only live once
285,of course you fuck do retard
286,very inspire this bring me to tear
287,keep up the great work that way we can keep support p
288,i have a friend who volunteer there
289,a very good organization
290,yum just make it
291,so good
292,great talk
293,one of the best in a long time
294,inspire to see young people so committed
295,one another note
296,why isn't this talk in a gender neutral ted
297,it's more than good enough for that
298,love this amazing courageous smart beautiful divine woman
299,god bless you hyeonseo lee
300,you be proof that humanity have awesomeness among us
301,i absolutely love you on this show
302,garret k have be keep up with his voting record
303,when you tie down good legislation with bad legislation which happen all the time sometimes you have to vote no and wait to re introduce the same legislation another day
304,that doesn't make you a liberal just a wise conservative
305,we know that be the plan of the dem's all along
306,it sound like they decide to just cut to the chase instead of beat around the bush but the objective be the same
307,it's about time
308,the previous senator's experiment be be a failure
309,the np be much well equip to manage this special resource
310,when will the public learn that everything the federal government do be not and will never be supportable on it's own np the postal service amtrack etc
311,if you think that be shitty music youre an idiot with no taste that eat mcdonalds and pay for michale bay movie probably
312,gorgeous
313,u look great
314,love the look crumb and all
315,lol
316,if you go to big the school may raise the fee yeah theyll raise the fee
317,youll have already graduate though leave that fee for the next wave of sucker
318,source be one of the sucker make the following year even bigger sucker by borrow cutlery and dish
319,hi jane a wonderful and insightful talk
320,please look at the value game at http ingenesist com introduction we specify social capitalism
321,you'll get a kick out of it
322,thanks
323,0bama doesn't need marsha to make him look bad
324,he do that quite well all by himself
325,thank you marsha for all you do
326,hang tough we be with you
327,interest although i be strike by the fact that there be no mention of grow human tissue in the lab
328,there be many case in which stem cell be be leverage to regrow thing like ear for soldier
329,i think a magic beam of pure light would disintegrate you
330,gotta keep it open
331,what can we do to help
332,i personally hate playing with unexperienced player
333,its either a really boring match or they play stupid thing like 4x tormods crypt in the main board of elf
334,fuck you for keep me out of prize
335,saw it last night
336,you be hilarious
337,ahah
338,thanks
339,amaze stuff
340,i hope the living organisms she document be able to continue survive for thousand of year to come
341,melissa speak like a true republican
342,wow amy so move
343,you really inspire me
344,thanks sarah
345,just get back from the festivity
346,very fun
347,think beer and clam and hot tub before the firework
348,happy canada to you
349,how be you feel
350,able to take in any of the festivity
351,love my give key
352,i believe it should be the motto of everything we do
353,lift all the thing
354,d
355,thank you for your support
356,wow
357,i'm at a loss for word
358,amaze
359,this be biomimicry at its finest
360,great presentation
361,fabulous photograph
362,thank you for share and for your leadership
363,no worry
364,hope you're well and thank a lot haha
365,amen we r watch geraldo u get this love you angie
366,nick oxford this be the worst thing i've ever hear danny brown be awful
367,awesome
368,my dream to do that
369,you continue to have my admiration and respect
370,feliz ao amigo senador suerte en todo
371,exito y salud
372,ya'll have get to read the odd series
373,love 'em
374,muslim brotherhood who love regular american youre live in a dream world neo
375,great
376,30billion down another 970 billion more to go
377,great job
378,it's amaze they be only teenager while i didn't know what i have do in my teenages in china maybe only do the test day by day
379,how suck we be
380,also their pronunciation of english be so beautiful i'm so envy it
381,yeah it's crash on me a lot too
382,this be so true you have to have the faith
383,sometimes it be hard to remember that
384,it be there for sure
385,hmm wow this be the next step towards ai i think have you see the movie i be legend
386,this be how it start
387,we cook them their final breakfast on the 20th look forward to hear their story
388,pomona kiwanis we rock
389,actually i have a nice as yes
390,yes you do
391,great superb info thanks for share
392,an excellent speaker who deliver a factual and objective ted talk
393,well do
394,i agree it's time for us to inform ourselves of the truth by seek answer and not merely accept them
395,no problem
396,and thanks for all the prop
397,what a big expense for the public
398,if u have a minute boo listen
399,this put a smile on my face nitra ne' harris
400,i love this trickster be rampant in southern folklore and be tracedd back to africa
401,emily be now one of my favorite humorist join jon stewart and tina fey
402,keep up the great work this be awesome
403,just wish i be closer and could come join a dig in and plant some shit with you
404,great organization you love fabulous congresswoman chu felix navidad
405,as a longtime now retired educator hear hear
406,you make me laugh so hard
407,so glad you're well back the uso
408,haha xd get ya
409,zombie protagonist and sequel possible good luck
410,great
411,there's no substitute for see it in action
412,haha thanks
413,they be the tamest of the bunch colourwise
414,no problem
415,i figure i should start follow back since you hit level 30
416,happy holiday to you
417,we be indeed fortunate to have you as our representative
418,congratulation to rep esty and many thanks for her support of equal treatment under the law one of our most important and value constitutional right
419,make me nauseous to think of the sacrifice those folk make and to see where our country be today
420,great idea
421,i've send on to the department of transport in the uk too at least someone there know about it now
422,dude all the website i go to be worthless except google you damn heathen
423,hang on in there pgood luck with them
424,shalom semator gillibrand and all my jewish friend
425,way to be work on our deficit debt crisis
426,get your photo opportunistic butt back to washington and get the work do
427,thank u for follow me back d
428,that make more sense i read foot of clay mumble year ago
429,thanks
430,all truth sir
431,thank you
432,thank you a lot
433,it be amaze
434,i as a man be very very boner
435,great content
436,i'm seek support for a panel of related matter at sxsw interactive march of 2011
437,if you're interested place your vote here http panelpicker sxsw com idea view 7068
438,only 200 of over 2 000 panel get choose
439,winner be base on vote
440,thank you
441,support hr38
442,this be our chance let's get it do
443,awesome presetation
444,in my age of 27 i believe i still have chance to be creativity
445,thank you ken
446,good let us all follow it
447,wow fantastic talk
448,what an amazing woman
449,thank you for stand up again chellie
450,i be pray for cong
451,giffords
452,several
453,own
454,here
455,be
456,just
457,don't
458,have
459,anything
460,well
461,than
462,to
463,put
464,someone
465,down even
466,you
467,don't
468,them
469,if you
470,don't like
471,him
472,turn
473,off
474,or
475,just
476,don't
477,wtch
478,him
479,i
480,personal
481,think
482,he
483,be
484,great
485,i don't think as cramp be something to poke fun at
486,so grateful
487,never expect it even though its our
488,3 6 will pay my hmsa premium if living under 400 of poverty the cola keep us there yeah
489,the fed be hedgefunding 1 5
490,it show
491,he look and move better for it
492,this performance be stun
493,thank you
494,that's some good stuff you're do in your pp
495,much respect
496,thanks for the fb
497,yes i do
498,i play in an adult league this spring and plan to play some pick up game over the summer
499,wish i coulda be there b
500,wish we have it in australia as well
501,follow
502,thanks for the mention
503,after watch the video i think that some of her experiment be interesting and that everybody make different choice
504,i be wonder what we look at when we try to make the best choice
505,like how we make the best decision and be the decision from heart or head
506,can't wait till episode 9 watch 8 on demand too many time and end up with the same facial expression star at the tv mouth open like the wow emoji and shake my head say mac do lose his ever love mind
507,thanks double l nice to meet you
508,that's all good and fine beautifully do
509,i have op tag as perf
510,loop
511,yes he do need a babysitter
512,i don't think the babysitter dress him for this photo
513,thanks for the tip just order some
514,im really tire of donald trump always something to say about others
515,dont you think if the president be bear in kenya we would know
516,i mean they have to check all document
517,come on we have better thing to deal with than this issue
518,hmmm government shut down
519,the slow stream time be kill me it stop to buffer 2x during the opening
520,this short video emphasize importance of use a good body language
521,accord to this video use a good body language can change the one person's first impression
522,therefore we have to use a body language well and properly to give a good first impression to many people
523,i know i saw you
524,enjoy your weekend senator murkowski
525,oh and happy bday
526,sticker
527,i'm sorry but nlp researcher have know and have be apply these principle for decade
528,so tell me if you think aca obamacare be bad why do you think the exchange in ryan's voucher plan won't have the same issue
529,congratulation
530,keep up your great work
531,its a common fucking decency
532,its the right to be hear
533,you're in lousyana good job be a defensive driver
534,stay safe
535,wow if this get back to day she be go to flip out
536,be he say this to anyone specific or just talk to the camera
537,i'm from nelson
538,hubby from tauranga
539,what about you
540,i'll be sure to tune in
541,good luck
542,i second what you say
543,ive vote on both side and im very disappointed with both side
544,we need a firm hand in the whitehouse withe ability to compromise
545,im a very proud american
546,as your president put thousand of sexual assault criminal back on our nation street
547,what a hypocrite
548,great performance tony
549,i find it perfect
550,so adorable
551,congrats and happy birthday
552,i guess
553,i work at a theatre company where i make the set
554,although the first day they didnt realise that and have me audition for some of the part lol
555,go madison
556,you can do it
557,whoo hoo
558,go get some gold
559,i cry
560,really move
561,we be all amazing creature fill with love
562,thanks
563,great appreciate
564,i find it scary that at a time when the most prominent conflict be root in the the greed for fossil fuel there be a prominent explorer who want to take this into space
565,what he have do be brave and admirable but to dress this proposal in the same cloak be frighten
566,and thank you for the follow back
567,good luck on the rest of the season
568,you should not wear the american flag on your head j
569,new in murrieta but big republican support
570,may the most high continue to bless this breddren
571,and may his message be carry to the poor the forgotten the afrikans
572,ashe
573,amen
574,selah
575,one love bless
576,thanks for follow me back
577,thank you for your kind word
578,my dress make me happy so i hope i do them as well
579,look like elise be support trump
580,oh no she must have miss the memo from her puppet master paul ryan
