,sentences
8340,her last ted talk wa wonder as well
8341,http www ted com talk sheena_iyengar_on_the_art_of_choos html
8342,you forgot the benghazi hash tag
8343,no i use shadowplay nvidia share
8344,id turn it off but im more interest in record over use the web browser
8345,thank for the suggest though
8346,ill test it with shadowplay off later
8347,edit with shadowplay off the overlay still doesnt work
8348,wow these pictur are fantast
8349,you seem to be realli a writer
8350,xd
8351,thi would work if everyon would do it at the same time
8352,it wa inspir i just believ that it could be danger when interact with someon who ha hidden agenda
8353,cheryl
8354,thank you for attend and speak to us have met and spoke with you a coupl differ time i find you honor and well intent and thank you for your servic to our countri
8355,the best i can do is support my friend
8356,it' actual one of my job
8357,hard not to follow someon with such a bright shirt
8358,noth normal about you traci
8359,yea kelsi
8360,soooo proud of you and your beauti art
8361,if onli we could have suppress italian immigr
8362,thank keg appreci it d
8363,hey richard bought a new fast car is total the best choic
8364,man' choic
8365,hahaha
8366,think about it in the realm of multi class i can total see where your come from
8367,i may make a slight chang where you cant dual cast abov a certain level of spell
8368,maressa stay strong god bless you and your famili 3
8369,wish i could say i wa make it up http news yahoo com s yblog_thelookout 20110302 ts_yblog_thelookout propos texa immigr law contain conveni loophol for the help
8370,hey
8371,no problem
8372,keep up the good work you'r do and good luck with your fit goal thank
8373,i use to be quit fierc when it came to cycl in the cold no worri
8374,and i hope to see you keep up the amaz work for me to prop
8375,i dont think you should be charg 18 interest against ur campaign fund
8376,oh man i had no idea there wa a chipotl lover group
8377,i live a long way away from ani chipotl so whenev i get close to one i have to stop and get some
8378,it wa a great speech by a remark man when he got person and look to michel hi daughter and the biden
8379,that a realli wild assumpt base on a singl sentenc that onli state she slept with two peopl befor they date
8380,hope the republican don't link the technic issu with email to border secur
8381,quit inspir
8382,thank you
8383,thank i tri
8384,i bought a hous that need gut so i'm never in need of a hobbi
8385,fantast work
8386,no one should ever deni their child thi import vaccin
8387,isn't it simpli amaz how genet sequenc ha come so far and open a whole new frontier of improv our live
8388,so proud of you louisa
8389,xoxo
8390,the joke is that the kid dress up is racist
8391,well like mookler said just shoot the damn boar a week befor the hunt parti
8392,he should be dead by then no need to instagib him
8393,i agre with halparin
8394,great debat
8395,thi man is veri great hope hi research will help more peopl
8396,thank you
8397,where can we view the act
8398,all the best in achiev your fit goal
8399,shelley ha my vote
8400,jim ballard
8401,omg thi is such a cute pictur
8402,and cheri look so happi
8403,the tone is veri offici and not genuin at all the speech is superfici definit not someth you want to see in ted
8404,then what do you want to keep big pharma in line
8405,tell us all becaus you can't possibley mean hippi vegan herb and ritual mumbo jumbo to cure cancer
8406,he can lay my carpet d lol
8407,hi maria ty for bene one s of bestist sen of wash st much love here to you n your famli too sorri my spell suck i l vote cantwel again thi yr too n whi you care for in wash st not dc
8408,again the best to you n your famli too
8409,and thank you for the fb
8410,have a great day
8411,thank
8412,i use the iphon cam
8413,happi easter wish you a happi one god bless
8414,sinc when doe a po libtard like sinema give a crap about vet
8415,oh ye
8416,when she' tri to milk someth for potenti vote
8417,never mind
8418,carri on
8419,my last sword that i made went from 17 at low qualiti to 20 at a hq
8420,the stat on my armor i made at 35 went up by 3s as well across the board
8421,back in the day they would have been hail as the parent who creat the she warrior
8422,hi jim
8423,i met you at peter woolfolk' parti
8424,keep it up
8425,well no one got rape so there that
8426,ok i total don't agre with keep that dog lock in a damn bag for twenti minut
8427,wa just catch up on your hard work
8428,great the human and simplic of thi idea
8429,i aggre montel now just to keep rememb that everi door ha potenti to be a door to posit thing
8430,thank for thi messag
8431,it help hope you are have a great day
8432,the art of the douch
8433,so do you
8434,and i can see that you'r much better at eat than i am
8435,i hope you like it c mmm
8436,mwah xoxoxo
8437,wow
8438,a truli enlighten person
8439,thank you for your insight
8440,thank you senat
8441,you have a bless day
8442,waaaaaaaaaaaaaaaaaaaaaaaaaa
8443,they look like they'r from the cia or someth
8444,it is
8445,thank you
8446,think of the farthest south youv ever been then go a lot farther i live in alabama and the town i grew up in wa 30 minut from florida and we did stupid shit like thi grow up
8447,im so glad my surviv instinct kick in befor my 10th birthday
8448,everybodi love eliott
8449,are you a moron or just corrupt
8450,7 billion in profit
8451,job sent to mexico you took the
8452,doesn't that hurt the man bit
8453,good even ladi and gentlemen
8454,were sure glad to be here in kokomo tonight
8455,were the good ole blue brother boy band from chicago
8456,we sure hope you like our show
8457,im elwood
8458,thi here my brother jake
8459,love the affect the volunt have and i wish human retir home were more like thi
8460,britward grimmer is a troll who live in texa
8461,block him
8462,i did
8463,so inspir
8464,i rememb i had day where i too said i'm not suppos to be here excel present
8465,hank is one real funni dad
8466,thank thi wa enlighten enabl me reason whi i constantli observ the artifici atmospher on live human all around and get irrit now my wife can be help understand my point of view will talk observ the loner phase
8467,serbian translat is good but 2 second late
8468,how to report thi
8469,actuali in serbia and bosnia radicalis is conduct in mosk not all mosk ofc
8470,everyon want power for them self and then separ come thro self interpr religion
8471,the civic si is still pretti access in canada and the coup look great
8472,my most sincer and deepest condol to their famili
8473,they are such hero and heroin
8474,may they rest in peac with god
8475,most great revolut the marin corp and nation are born in breweri
8476,it just as much of a cunt move as dive to get a penalti
8477,yeah got a bit bore with the last one
8478,tri to eat more fruit too so thought i'd chang up the pictur
8479,sick of see my mug whenev i log on
8480,awesom
8481,a thinker for earth
8482,it is onli possibl by educ the local popul
8483,it need patienc to coordin everyth but i wa rather surpris how it went fast to recreat thi kind of ecosystem
8484,thank you
8485,good luck on your goal as well
8486,everyth from bf4 to dirt ralli to civil v and kerbal space program
8487,i agre it is more obviou in fast pace game but in ani game everyth is much smoother
8488,love thi common sens approach
8489,it' nice in thi crazi polit climat to be abl to be proud of one' congresswoman
8490,thank
8491,my old profil wa me as guil so i had to follow
8492,ye i probabl should
8493,their stock sure plummet be associ with your scumbag ass
8494,wonder if they were told to applaud or els
8495,o my godsh he is wonder
8496,that whi i love thi sport
8497,it doesnt get more intens pure and real than that
8498,nowher
8499,wa look for new app to get and thought thi look cool
8500,you'r like a beast on thi app
8501,high level
8502,i love that you do thi i wish more repres reach out to their peopl like you do
8503,thank for share
8504,realli inform one and best tweak too
8505,karen ha an optim on religion
8506,global i don't see applic of the golden rule by christian jew or muslim
8507,local peopl who are religi assum a moral superior that is unmatch by their behavior
8508,while i hope for the rise of karen' wish i don't share her optim
8509,thi wa a great interview
8510,can't wait for the tyson movi
8511,amn jam se debe permitir que lo castro se le entregu guantanamo eso siempr tien que ser propiedad de estado unido para poner a lo terrorista empezando por lo castro
8512,postal worker some of my favorit peopl
8513,my busi depend upon them and they have rare let me down
8514,in the past 12 year i'v sent thousand of packag all over the world a total of 2 were lost
8515,now that' effici with a capit e
8516,you bet
8517,veri impress weight in your pp
8518,alreadi done
8519,no on 1 2 and 3
8520,same to you man
8521,keep push hard
8522,happi new year and bless to the famili safe travel
8523,you too have a great week
8524,o
8525,tiffani stop by to say hi to me
8526,xo faint
8527,hey girl heeeeyyyi
8528,d
8529,ted cruz reap what he sow as voter in south carolina rememb hi dirti trick in iowa
8530,http goo gl cghybk share
8531,it' your parti who doesn't want to foot the bill
8532,i thought the gop wa the new parti of and for the coal miner lol
8533,happi thanksgiv congressman massi
8534,and she did a great job
8535,thank michel so thank for thi emerg experi
8536,thank you
8537,you'r in detroit
8538,you should follow lokkju all around badass lifter and gener nice guy who live there too
8539,you are most welcom your hard work need to be prop
8540,thank you for your repres us by attend america' inaugur
8541,all the beauti peopl
8542,you look so handsom
8543,one more for my collect
8544,it' so cool
8545,if the kit wa to be sold for ordinari peopl i think it would be a good tool for learn about electron
8546,fascin and promis medic develop
8547,damn wish i wa there
8548,yeah i need to get back to exercis regularli
8549,i'v been slack thi semest with school and attempt to spend my free time with jen
8550,i'll tri to keep thi up
8551,do you know if there is an app for thi
8552,child pornographi is legal now
8553,obama got hi behind hand back to him yesterday by the leader of the emerg republican major
8554,as good as i expect
8555,i applaud you monica
8556,you are claim your stori and use your voic for good
8557,to the ted moder i respect ask that the team review the moder on thi thread the misogynist comment that are get through here are not help to discuss
8558,i think more interest then the talk wa the photograph concept of place the dog in the pictur
8559,i wonder if there is a write up on him state hi reason for come up with the concept of thi photo shoot
8560,it doesnt chang my hate for them
8561,now
8562,http twitter com onlynomali statu 821388395637342209
8563,2017closingcatsdogsmeatmarket 2017worldmediasdwithmarcch 2017worldmediasforhouseresolution30
8564,thi talk made me realiz that i would never be abl to imagin how it feel to lose a limb how you feel your finger touch someth when they don't exist
8565,thi is amaz and touch me veri deepli insid to see the patient smile in the 'after' video
8566,and the 360 wrist rotat haha
8567,thi is sooo excit
8568,congratul from the martinson'
8569,so so happi for you
8570,it' veri funni
8571,i knew the cultur about middel east
8572,and i want to travel there becaus of your speach
8573,i naver know what the middl east peopl think and how they laugh
8574,your speach is veri funni
8575,merri christma geraldo
8576,god bless
8577,fast breeder reactor just what i'v been advoc to anybodi who listen for the last ten year
8578,i had noth to do with design them but i got past the fear and paid attent to what wa go on
8579,who is sponsor thi kid
8580,larg part of the republican parti have gone crazi one day it will chang but not today
8581,hehe
8582,whi thank you
8583,all you idiot that think she can vote or have influenc on her first day are the same idiot who vote for her
8584,mayb if you actual where inform about how the govern work you'd vote with some educ as well
8585,fool
8586,wow
8587,great talk
8588,vast improv over last talk both great
8589,you go girl
8590,don't see ani link to town hall in the sb sun fb page
8591,realli well democrat were the caus of it
8592,naaaaa you'r gonna smash it
8593,d
8594,be from wyom i wa proud to see that hat the man wear it
8595,win with women
8596,tammi is a win woman
8597,vote for tammi vote for il
8598,welcom
8599,a few tip get start guid on the web http bit ly i5poxp on iphon http bit ly n2ixh contact fitocraci http bit ly xy1xfp
8600,you gloriou bastard thank you 3
8601,long live the attent whore
8602,congrat chuck
8603,excel addit
8604,i know it gonna be great
8605,wowowo someth i can agre with you on
8606,nice
8607,hey david sinc you'r in the neighborhood still look for that meet
8608,pronax and constant stupid forc buy
8609,dont forget instead of save ak pronax decid to peek with no kevlar
8610,ah the lamestream media
8611,i think thi is a lot closer to the truth http www naturalnew com 033628_operation_fast_and_furious_atf html
8612,yea
8613,i love the smith
8614,d
8615,good luck i'm go to tri start exercis daili for 30 min per day
8616,i think thi wa a veri interest stori
8617,i alreadi knew that your bodi languag ha an influenc on how you feel and how other peopl see you but i didn't realis it ha such a big influenc on what other peopl think of me
8618,that is good to know
8619,joseph dockerti whi don't you do everyon a favor take your hate fill life somewher els
8620,not good not good at all
8621,down with fever and throat pain
8622,kill sadli in a war we start under fals pretenc
8623,stop use these soldier to justifi your warmong
8624,a beauti craft speech which wa a pleasur to listen to
8625,thank you for make such a thought provok and power statement on compass
8626,may your messag spread far and wide
8627,you have turn a nightmar into a dream for the futur
8628,wish you all good thing on the road ahead
8629,you keep workin' i'll keep propin'
8630,i could watch thi everyday
8631,move me to tear each time i watch
8632,it illustr so beauti how we are all connect
8633,our one from the beauti of natur and a smile and how that impact us if onli we let it in
8634,outstand
8635,i love the way you write
8636,everyth
8637,book stori blog facebook post tweet you'r so eloqu it drive me mad
8638,in a good way
8639,thank for be an inspir
8640,i love thi histori is a sign of inspir
8641,everyon is a scientist
8642,i realli thought that thi talk would be about get rid of the need to believ in a superior power and not just a mock of christian
8643,but still amus stori
8644,that make way more sens
8645,we need to drill our own oil and stop buy it from countri that don't like us
8646,cute littl shed out there in the snow
8647,look like the one in my back garden
8648,merri christma to you and your famili sir
8649,i can feel joan' deep compass throughout her talk
8650,her messag is so simpl yet can seem so difficult to mani peopl
8651,compass empathi for peopl other than peopl you are connect to through familiar can be out of reach for mani peopl for mani reason
8652,such a wonder talk
8653,dale que tu pued
8654,you both had fun
8655,a game is a game
8656,rest and go grimm
8657,you'r welcom thank you for follow back
8658,good win for shelbi
8659,hey madison how are you
8660,no worri im the same way
8661,hello your high
8662,welcom to the site a few tip to get go get start guid on the web http bit ly i5poxpon iphon http bit ly n2ixhecontact fitocraci http bit ly xy1xfp
8663,where thi is lead to some futur place where all life is control by comput schedul time and the best utilitarian decis made for us by some univers computeris tool
8664,as is probabl a clich by now programm influenc more of the futur than politician
8665,you are veri beauti
8666,yor deserv the great vote
8667,thank you for all you do for somervil
8668,you are most welcom
8669,man he is sexi and that smile
8670,nice job
8671,just enter it on the track page as run put in the time and distanc and the quest should take care of itself
8672,i vote for you
8673,if you are in near heidelberg come see us
8674,yeah that' whi i follow you
8675,four boy
8676,respect
8677,the nation associ of realtor just formal approv me to repres you as an fpc
8678,hey you got it
8679,thank for the follow
8680,so glad thi talk is well receiv
8681,water sanit hygien are such import topic and not onli in the develop world
8682,sound like an absolut awesom weekend
8683,it doesn't have to be a competit
8684,we can all love each other' pictur
8685,and you vote to shut down the govern too
8686,which way is the wind blow today
8687,thank you senat
8688,now pleas help to protect the delawar bay shorelin and enhanc our econom develop by find the fund for the channel deepen project
8689,would love the talk if i could watch it
8690,thi talk seem to have been hijack by ad
8691,as soon as hi imag start it switch to an ad for coca cola and variou other ad
8692,so mad about thi and don't know how to fix it
8693,yep she'd rather talk about her fkn turkey and ruin everyon else' thanksgiv lol
8694,in my opinion best moment are at 11 08 10 20 and 09 05
8695,will do
8696,lol got to work hard to play hard haha
8697,bellissima e bravissima
8698,complimenti
8699,randi weber you need to be fire for threaten our free press
8700,you sir took an oath to defend the constitut of unit state
8701,that includ free speech
8702,mayb you should read our constitut
8703,from angri texan
8704,who will not be vote for you
8705,you are welcom hon
8706,o
8707,no that us price
8708,your budget still is in the 7600k ryzen 1600 rang
8709,the use hardwar will sever limit upgrad
8710,you should buy new
8711,not too bad
8712,i'm still learn the rope but so far it' promis
8713,merri christma eric vote ok on higher tax on rich in exchang for futur balanc budget
8714,thank jim way a z minnesota rental
8715,no other talk ha brought tear to my eye
8716,you broke my heart with your memori of your father' fear
8717,thank you for so eloqu explain what is so hard to understand
8718,never befor have i felt so close to understand what it must be like to grow up black in thi world
8719,the divin love that unit man and woman grow in the heart of their children and give mean to their live to tear apart the famili and make children ward of the state is a tyrant' dream and thi is obama' dream
8720,wow
8721,what a strong woman
8722,one of my favorit scriptur
8723,ha help me in live out my life
8724,wow
8725,that some kind of camel
8726,amaz
8727,no problem
8728,right back at ya
8729,i'm with you rep matt y'all rock
8730,now if you can get the fed to do thi kinda stuff man what a countri thi would be eh
8731,folk say one thing i do anoth anoth
8732,and i will be happi to take them all in dear
8733,while i agre there a few full of polygon that are worth it now
8734,like ff7
8735,jack and everyon els is there potenti for drill on land that are not protect in wa
8736,ga
8737,thermal
8738,oil
8739,love it so the begin of so much more miss gwen
8740,thank so much for follow back
8741,thi is an awesom talk thank you
8742,http www thedailybeast com articl 2016 10 26 mark halperin tell trump what he want to hear in embarrass interview html
8743,i hope you are arm too or is the world readi for biker like that
8744,linda nia bendicion a todo buen trabajo
8745,veri proud of him
8746,that day in the morn he help a woman that wa look for justic
8747,i realli appreci your hard work with our commun
8748,photo
8749,good luck
8750,i realli hope you make it
8751,pleas reach out to mr trump
8752,i know we have other press issu but could you see about help the texa offici to ban the tak test from a teacher' standpoint and parent standpoint
8753,it is get my kid frustrat
8754,2 6 ng act and social spread your wing and i wish you onli anoth 60 year if progress scienc should allow
8755,g d bless i wish to meet with
8756,you can see how genuin affect she is as she speak
8757,that in itself is inspir
8758,i did thank
8759,knock 16 minut off last weekend a race
8760,how did your go
8761,love the smile giggl
8762,dog hater
8763,think human are far superior dog life matter dumb ass
8764,that' so nice feel better
8765,whi do you have a whole day dedic to them
8766,that' a lot of wast time spent on isol
8767,it' a maze i love thiscovers it make me feel cheer up and inspir me to make my everi effort to go the place where i should be
8768,i found thi veri interest and i am excit at the possibl he speak of
8769,it' inspir and to a certain extend it' touch
8770,thank for the video and it alow me to reflect on myself
8771,i can relat to thi and it make me feel warm
8772,love it that you'r in ann arbor
8773,my son is live near detroit and encourag all of hi a cappalla friend to get out and vote for you
8774,no problemo
8775,glad to have you on my feed
8776,you make a good point i think it is becaus anytim you have that long for fan to build someth up in their imagin the odd are they arent go to be happi with it
8777,fan had 20 year to build up expect that becam unrealist
8778,i agre with you repres gallego pleas talk some sens into my repres raul labrador r idaho and mike simpson r idaho they have a problem with listen to peopl that disagre with them
8779,i like the use music but i love them after find out how similar their religi and life experi are to mine
8780,for that i love them
8781,the world is more danger now than at the height of the cold war
8782,atheist arent too fond of have their own idea
8783,better get those iceberg readi to turf all the peopl under age 54 out onto when they don't have medicar help them in their old age
8784,oh yeah forgot there won't be ani iceberg ani more
8785,stop the iran deal
8786,learn more http pragerunivers com polit scienc the iran nuclear deal html vfez_flvikq
8787,oh and welcom to fitocraci
8788,come back to tacoma pleas
8789,your welcom
8790,anytim
8791,thank cuti don't be a stranger
8792,congratul on your endors by icaucu
8793,it' not easi get over 70 on their score criteria
8794,it is an eye open
8795,i like the thought been present by the speaker
8796,i am so impress by your comedi
8797,lol buddi
8798,wish you a success 2016
8799,be a rom com dont they all inher fail the test
8800,excel speech
8801,first i wa a injur victim at the logan hall incid
8802,still wait for compens
8803,second when are join the dem
8804,the terrorist don't blow themselv up kill peopl just becaus they enjoy do it
8805,we as the whole of the world should be help everyon to have a happi life in which there is no need for these horribl action
8806,now that would be crime solv
8807,10 shot 3 die
8808,who is teach respect for life
8809,i am walk for tammi duckworth on saturday oct 13th
8810,offic 1310 w northwest hwi
8811,arlington ht
8812,il
8813,it is a beauti season to walk for what you believ in
8814,art root in electron technolog will alway becom obsolet pass and quaint
8815,thank congressman frank for all that you do for us and az in uphold our right
8816,i don't want thi tax
8817,govern should not have thi type of power i wa just vote in as 2nd vice chair for ld 13 republican
8818,we cannot wait to have you back as a speaker at one of our event
8819,romney 2012
8820,it' about time medicin get to the root of ill
8821,bravo
8822,apart from keep the rain out and produc some use space architectur is noth but a special effect machin
8823,i stop watch from the moment she said that came back to give her a second chanc and wa abl to hear her for 2 minut
8824,seth so sorri to hear he wa your most ardent support
8825,success begin in selma
8826,landon lee nichol
8827,good for you congresswomen your neighbor us illinoi congressman lui v gutierrez
8828,ye and it wa disgrac and horribl disrespect to bode miller
8829,if i were the head of nbc i would have fire her immedi
8830,lol it' been on there but mayb doesn't make sens now that i don't have a tire pp
8831,and of cours i can
8832,well thank you
8833,certainli happi to follow back
8834,gun control anyon
8835,2nd amend right to bear arm to form a militia becaus we were a newli form govern without a militari
8836,i'v been lightli distress for year
8837,you'r welcom
8838,50 doesn't feel so bad eh
8839,nice to meet you
8840,thi is the first time i see a succes group product
8841,i'm happi to know someth like it is realli possibl
8842,and i'm sad that i know so littl about music and i'm also first time jealou i couldn't be part of thi
8843,thank you
8844,may he rest in peac in heaven with our lord jesu christ
8845,beauti smile beauti pic
8846,my daughter is 6yr old and she said she gonna beat u one day
8847,lol
8848,ms chapman you are sell the repulican agenda say the republican are the onli one that have a plan to save medicar
8849,our social program don't need save just not turn over to the republican parti
8850,best parad in the counti on monday is in tini rockdal right where aston mill and lenni height get togeth
8851,mani familiar face from our local govern
8852,i receiv in jesu name amen
8853,brit your segment about trumpa potenti suit against the women accus him of grope assault is total bunk there is evidenv that he wa set up that is the most relev part of the trial the question is would thi be happen if he wa not run against crook hillari
8854,my first pokemon card
