,sentences
4257,keep work hard
4258,cheer mate
4259,i find it deplor that you are not attend the inaugur of the next presid of the unit state shame on you
4260,there is no way you can pretend violent attack a peac demonstr wa ok
4261,you are incred
4262,challeng accept
4263,where exactli did u do it
4264,quit a few penn grad here it seem we should start a group
4265,you are the bread buddha
4266,love it
4267,what is your problem with refuge
4268,do you have ani compass for peopl in need or are you so wrap up in the militari industri bubbl that you can't see the realiti of a countri that welcom your tire your poor your huddl mass yearn to breath free
4269,shame on you
4270,muslim
4271,it spell muslim
4272,dota2 is the saltiest game ever
4273,i love it but god the salt
4274,the salt
4275,yah i offer to pay ship but they just sent me the ship inform
4276,it a 2013 ford f 150 super crew fx4
4277,your welcom and thank you in return
4278,good luck with your goal
4279,congratul karen
4280,well earn
4281,thank you for the fb
4282,i have a besti name karli ms carli look forward to prop you in my feed
4283,thank for follow back
4284,he face overwhelm challeng that most of us in our live will never have to face
4285,but hi intellig hi passion and hi determin brought about success and he wa abl to help not onli himself but hi famili and hi commun as well
4286,you'r an inspir william kamkwamba
4287,how can dennett' argument be 'compelling' if hi conclus is that you can't trust your own brain
4288,sure thi is self defeat
4289,i know craig like crazi sock
4290,check these out
4291,also an inspir stori
4292,hope i post thi right http www facebook com johnscrazysock post 275038306233288 0
4293,same here
4294,work hard play hard
4295,it' cool mine wa too slow
4296,keep it up
4297,vamo todavia q quiero vert en la casa blanca mr presid ruben kihuen
4298,matt is what we need and no one els
4299,just follow hi record that speak for the type person he is
4300,i see dumbo hug hi mother
4301,look at you
4302,190 x 2
4303,that' seriou
4304,can't wait to see what els you get up to
4305,still think the idea is pretti good despit scumbag
4306,so beauti just like chri
4307,i recal the time that martina chri were on an episod of oprah they discuss the chri evert rose
4308,i think that ms oprah herself wa a littl enviou tee hee
4309,let' encourag some young peopl
4310,thank you for your leadership congressman
4311,seth came across clearli as presidenti friday night
4312,i think a lot of peopl thought the question from the audienc about who' your favorit poet might be awkward for him
4313,not so he immedi identifi edna st vincent millay and then quot the third vers from her travel poem
4314,you'r a good man david
4315,d
4316,thank you
4317,i'm proud to know you were there today too
4318,secur border b4 some terrorist group bring dirti bomb into the u s
4319,cheer from costa rica
4320,i'm glad we have someon like you in congress who' stick to her gun and do just what we elect you to do repres the peopl and not the ceo
4321,we are lucki to have you repres the 99
4322,keep up the good work
4323,don't forget to call john boehner' offic 202 225 0600 pass the ui bill now
4324,vote all republican obstructionist out in novemb
4325,shame on thi congress
4326,thi made me lol for real becaus i'v been guilti of the same mayb a few time
4327,sushi too oopsi
4328,look back dure the last few decad the clinton year were the most prosper and peac for our nation
4329,furthermor they were the onli time in gener that we had budget surplus real peac and real econom expans
4330,hope you are not the onli woman involv
4331,for me the insan is hang on to the idea that it realli matter what other think
4332,live life for yourself becaus it is hard enough to make yourself happi
4333,if other enjoy what you creat fine but don't expect it and don't crave it
4334,hooray
4335,re follow
4336,thank for be so thorough
4337,3
4338,gret video
4339,thank for share
4340,veri good present
4341,i'v watch thi sever time and enjoy your insight
4342,look at the number of view i'm not alon
4343,i had the same stroke and i am 19 year old
4344,the best thing is be a femal we can recov damag part of the brain from a stroke faster
4345,i had to go through month of therapi becaus my left side of my bodi wa numb and i could not use it
4346,wow thi video is amaz
4347,thank you
4348,no problem thank for follow back d
4349,wonder to read the news about madelin singa elect to nassau counti da
4350,now that technolog ha becom the catalyst for imagin a new and more profound respons lie with the user of thi tabula rasa
4351,may thi blank page of inspir prove to serv the world commun in the purest sens
4352,great may live long
4353,ok thi is way too big brother for me thank you veri much what is next a barcod on our wrist i shudder call me an old fashion lay epidemiologist but you guy are miss the ethic point of view you know die gedanken sind frei oder die arbeit macht frei back off
4354,i wish i could be there jacki but i am in ca babysit my grandkid
4355,i have seen what a motorcycl accid and just jean can do to you
4356,hello hip bone
4357,interest
4358,but a person can have their internet access prevent
4359,i have seen thi
4360,how then could they access a data bank in anoth countri when they cannot use their own
4361,keep move from cafe to cafe perhap and keep chang persona
4362,dr carson could excel in ani posit trump place him imo
4363,you dont know if you dont tri
4364,have a 2 1 bodi is just ice on the cake
4365,fiscal conserv polici is how we live too bad the unicamer and congress won't do the same
4366,thank for the follow back
4367,thi is nice
4368,can we pleas do someth realli import
4369,democraci just got smash and thi is your news
4370,histor moment
4371,these are the black american boy that all of america need to be introduc to
4372,congratul to all the parent and caregiv god bless you all
4373,you'r look so gorgeou and wow those leg and thigh amaz
4374,fantast wish i new it siz year ago and tri it out on my son
4375,congress love to cut from the taker but they also love thier coffe did ya'll see the news report from the gao regard spend within each lawmak office' hahah good ole boner spent 2500 on coffe and anoth spent about the same for espresso
4376,bunch of bs
4377,we just did our too
4378,your look great
4379,thi is just amaz
4380,love you tammi
4381,good luck tomorrow
4382,ye he doe
4383,prais the lord
4384,thank you so much
4385,i appreci your kind word
4386,hope you heal soon from whatev you are go through
4387,right back at you
4388,if i can help at all let me know
4389,how can the american peopl trust and work with a liar and fear monger
4390,he' so low class
4391,you made a great effort
4392,don't be upset be proud
4393,i would realli like a respons to m inquiri i sent a coupl of week ago to the on line email address
4394,if no one can assist pleas let me know and i will stop hound anyon in congress and go anoth avenu
4395,thank
4396,human and nuclear power equal a bad combin
4397,too mani idiot out there
4398,i'm so veri proud of you alonzo
4399,tell obama hello for me
4400,yea
4401,you'r back
4402,you found your motiv
4403,thank you for alway support worker and our famili
4404,how can someon rate thi awesom talk as 'unconvincing'
4405,thi man is strong and ha touch me deepli with hi stori
4406,j r it' sad that you feel human need profit to motiv our live
4407,oh he look so cute here
4408,no prob
4409,nice bodyweight workout you have there
4410,thi is someth i need today glori to god
4411,hey yeah i'm here
4412,hoorah
4413,i will have to agre with you
4414,pre obama kick butt good on him he earn point in my book
4415,throw pre bush a bone for hi action as well would be appreci
4416,hi i'm muriel hall i meet everi famou politician that i like and they alway win
4417,love it m
4418,my pleasur
4419,have a great day
4420,p
4421,and for god' sake peopl if there' a butterfli ballot pleas look at it care and don't vote for pat buchanan
4422,with wisdom and grace guid you bonni go forth and do great thing
4423,optic drive are becom a thing of the past
4424,i complet left one out of my rig
4425,and yet my last two health care premium rais have been the smallest percentag rise in 10 year
4426,i love the way thi guy think critic about himself and still think outsid the box
4427,it realli cool how he chase these big topic
4428,i hope he will go further with the other question
4429,differ world great ideal hard work best stori about the most interest thing in the world about us
4430,long enough to be familiar with the time in hip hop where it wa common to kill other rapper for their music
4431,how mani rapper have kill other rapper
4432,ive heard theori with tupac but besid that i cant think of ani case where thi happen
4433,i'v watch thi video over and over and i love it
4434,love break down barrier even the smallest effort can make a huge differ
4435,we are a rare breed on here
4436,where are you from
4437,you sir are hilari
4438,what a brilliant idea it' amaz how power 1 second worth of footag can be to evok memori
4439,i'm complet on board with film at concert
4440,sometim nowaday we forget to see thing through our eye not a screen
4441,you can do it kayla
4442,happi birthday presid reagan
4443,r u still slurp and swallow your daddi obama dna
4444,anyon who dare tri thi in the idf will be in prison for a long time
4445,thank god
4446,i thought thi wa go to be a thing
4447,guess it simpli go to be kill children and refuge for the idf
4448,the bay area ha it best weather in septemb
4449,u nobodi els but u lol 3'
4450,sei una donna splendida e dall ampi qualit 3
4451,what a great ambassador for thi movement
4452,i'm go to add edibl to my garden thi spring includ my front yard garden which is a challeng caus of foot traffic
4453,episod 5 wa ridicul
4454,i had to keep watch becaus of that
4455,there wa just no way that
4456,seem right
4457,no way
4458,proud of you calvin hank
4459,from one of your buchanan st ne neighbor d water
4460,saludo tan hermosa princesa d la linda sonrisa bso
4461,honor our hero freedom is not free
4462,as my mother told me the mean doesn't alway justifi the end
4463,go congresswoman
4464,go debbi
4465,that is a pretti fair asses but despit it be imbalanc it still fun to play even if it a littl less so as alpha
4466,first light is just simpli not fun to play becaus of how imbalanc the interceptor is
4467,i miss you too
4468,when you come back to see me
4469,i can understand that as they want to make sure that the dog dont get overtir
4470,good to know you will back on us open
4471,god bless you
4472,shelbi you don't know me at all but your mom ha been work with us and i have start follow you becaus of her
4473,i am so thrill that you have achiev so much at such a young age
4474,keep work on 10 000 hour
4475,that is the magic number
4476,if brad doesn't want you we'll take you if you could replac ani of the brain dead from the neck up so call repres we have in thi state
4477,onli peopl they repres are big busi and the wealth
4478,thi is the first ted talk that i made comment on
4479,i'm ph d student do the research thing everyth
4480,i'm total impress by the their girls' passion
4481,they'r fabul
4482,annett wise up
4483,we fight war for oil right and blind evangel dream of creat new market for religion and export
4484,we should be use websit like http nextdoor com to help us do thi type of thing
4485,thi video wa extrem inspir
4486,thank mike and thank for the follow back
4487,that' the plan and i like to keep the young one guess too
4488,thank you for cover thi stori
4489,sinc when doe stark care about peopl work
4490,he hasn't written anyth sinc '94 anyway
4491,i love how he is tri to calim he author obamacar win thi thing for us all eric
4492,nice
4493,proper jealou
4494,wish i wa there to cheer you on girl and jess
4495,pleas do show in san diego
4496,merri christma to you congresswoman suzan delben
4497,thank you for all you do for us in d c
4498,there' no other way out of the enorm except to forgiv the debt and start with a clean slate
4499,otherwis thi is go to lead to the next collaps in the u s economi which will result in far far more cost to everi american
4500,i love and miss you craig
4501,wow nice inform
4502,i alway have a good feel after run and chang in mood
4503,if peopl take anti depress regularli doe it effect neg in the growth of new brain cell
4504,http www theeverlastinggopstopp com 2014 09 iowa republican mangl constitut peddl conspiraci theori senat race
4505,tbt gee gift the legend 1 unsign underground hype http www facebook com geegiftedthelegend1 post 505040269665871 peter rosenburg
4506,i think you just did pass me up
4507,i'm go to have to get back into my deadlift to rack up some of them point haha
4508,challeng accept
4509,wow lisa you realli don't have anyth better to do that play with fluff bill and smoos with athlet
4510,bitch be crazi isnt the timeless sagac you seem to think it is and even if the bitch be crazi there still a causal and intern logic to what she think that can be comprehend and address
4511,hmm i alway thought that the 1st human like civil on america were in south america around the south of currentday peru argentina
4512,seem like they got there from the north though p
4513,way to go mike
4514,i'll alway vote for u
4515,what i'd like to take from thi video is that despit what we believ in we should not be afraid of ask ourselv question about our faith and belief
4516,i doubt marsha will respond to critic
4517,we want to know what you and the rest of congress is go to do about the thousand of syrian refug terrorist that obama is let in thi countri
4518,yeah he is sound like one on a few issu it doesn't say anywher in hi propaganda that he is a dem
4519,use hi son in militari garb as hi prop on the front of hi advert
4520,enough of harper tactic let be honest and allow transpar
4521,we can chang govern again if requir
4522,let not go down that road again
4523,one cannot connect anyth in thi administr with common sens
4524,i find it frustrat that the collect mass of our polit repres can't seem to do anyth about it
4525,not realli
4526,i'm in the middl of what i'm go to call law school boot camp
4527,i'm in my last year so i don't have exam except for the bar exam but i have a two week intens program i have to get through
4528,i'm halfway done and it' kill all my time
4529,and motiv
4530,and gener happi
4531,who' surpris
4532,he doesn't seem to have ani killer instinct
4533,i found a beauti mashup about the brain the choru wa taken from thi talk
4534,brought tear to my eye
4535,http www youtub com watch v jb7jsfevz1u featur bfp list plf5823592bf7aefa9 index 61
4536,it mean my daughter 22 can remain on my health insur
4537,noooo way stay
4538,have an up vote michel
4539,it' amaz to see how one person' brain explos can affect others' brain to expand
4540,thank you jill
4541,it wa a privileg to meet you
4542,if you were to write mta on someth transpar and you look at it from the other side it read atm
4543,oh
4544,me so disappoint
4545,jk
4546,well still nice to see korean on here i guess
4547,push forward
4548,both model are equal beautiful
4549,each on their own way
4550,3
4551,yay
4552,i am so happi to see thi talk up
4553,i enjoy watch it at ted
4554,definit one of my favorit jane and kiyash are great folk
4555,too bad the peopl of nyc don't have the right to self protect
4556,they'v made them sit duck glad to be in arizona where they haven't strip those god given right from us
4557,did you ask him what hi favorit cuban food is
4558,racist
4559,at thi point id be consid a 21 9 monitor
4560,shit when pay day
4561,theyr look quit afford
4562,lookin at you lg 25um65 p with your 2560x1080 and 190 price tag o
4563,great talk
4564,well done suzann
4565,preserv your languag preserv your cultur
4566,congresswoman zoe lofgren thank you for your fearless leadership to fight for these injustic
4567,we know without a doubt that there wa a cover up or they would not have went on tv say it wa a utub video
4568,then had the man lock up for make it
4569,tri to put the blood from their hand on hi
4570,they are despic
4571,i have a splashdown grand turk hat that i got in octob
4572,did you get to pillori beach
4573,if you walk along the shorelin you can find your own privat beach and some of the most beauti shallow water snorkel around
4574,whi don't you show dinero with bill clinton
4575,there are video out there
4576,space base solar power can easili solv for the world' energi problem and with no emiss of ani kind it will solv for global warm
4577,we just need to invest in thi tech befor it' too late
4578,it wa a long day thank you although i'm devast by the abort amend
4579,burstein give a simplist view on the complex of creativ
4580,interest
4581,thank you sweeti stephi 3 mwah xxxxxxx
4582,in thi talk dennett describ the live cell of the bodi as unconsci robot
4583,can someon point me to evid support thi view
4584,i would also be interest in evid that doe not support thi view
4585,thank
4586,fair statement
4587,care to share the show which top your list
4588,just curios of cours everi person is entitl to their own opinion
4589,vote cast in your direct
4590,the speaker is a realist
4591,i hope you have a wond thanksgiv too
4592,you are the greatest
4593,thank you for follow back
4594,look forward to see all the awesom thing you will do
4595,we miss you when you'r gone but we assum you'r just so busi with work out and life that you can't get to the comput
4596,d
4597,hope you took time to relax and enjoy famili too
4598,thank you for your leadership
4599,so cool
4600,i wish these kind of techniqu to spread all over the world veri soon
4601,show these tool to develop countri might help i think it may increas thise children' creativ
4602,just embarrass
4603,american are laugh at thi stupid ad
4604,i have come to believ that 'come true' is not the onli purpos of a dream
4605,it most import purpos is to get us in touch with where dream come from
4606,where passion come from
4607,where happi come from
4608,even a shatter dream can do that for you
4609,amaz
4610,ye and you dont see thi again until diii where peopl have some skill but are humbl enough to realiz that they are not the best so it creat for some realli friendli rel high level game
4611,supervis is all about angl
4612,ye thi wa interest i think edward tenner speak clearli and with purpos
4613,no problem thank for the follow as well
4614,congrat cant wait to see it
4615,i also have a tenni dog
4616,photo
4617,then i have been watch thi for the 3rd time today yet i am not will to start do the work i suppos to do 1 month ago
4618,awwwwwwwww
4619,ps nice draw love the panic monster
4620,same it made me extrem sad as well
4621,it remind me of the innoc of childhood
4622,it an imag of a simpler time
4623,that hat is red carpet worthi
4624,i wa veri impress with thi present hi perspect on educ
4625,no 2 children are the same should not be taught as such
4626,thi ha help to reaffirm my opinion against the common core standard our nation state board of educ is tri to implement
4627,incred awe inspir stuff
4628,she should have gotten all the media coverag that oscar pistoriu got last summer
4629,how about pass the unemploy extens immedi
4630,money should help american famili befor be sent to the ukrain
4631,pleas support euc
4632,hillari should take a page from her husband call it the one hundr thousand new babysitt on the campu program
4633,what are you do to stop illeg immigr
4634,good remind from our congresswoman matsui who we'r lucki to have
4635,thank you veri much for all the great thing you are do for us congresswoman maxin water shot out to you from all the resid of public hous esp mar vista garden
4636,you'r veri welcom
4637,thank you for the prop
4638,it is interest to know that we can cheat ourselv by bodi languag
4639,sometim it is necessari for us to do that especi when we need to pump ourselv up
4640,i love the part of withhold the pay of lawmak if a budget isn't pass by april 15
4641,someth like that should be perman
4642,the way that congress is show us that they are readi for a seriou convers about immigr reform is by have stephen colbert testifi in congression committe in charact no less
4643,awesom talk thank you
4644,wow 11 hour of bellyd
4645,crazzzzzi
4646,the mother' life matter more than that of an unborn
4647,your care prioriti should be toward the mother
4648,i miss it too
4649,hope i'm feel better again thi even so i can reunit with it
4650,how great that with some slight chang your bodi can becom alltogeth more healthi and improv brain function
4651,it is realli realli inspir now i am 20 year old and i am start to think of the way to spend my life and the way to add more mean to it thi speaker must have experienc a lot of funni thing which i realli admir
4652,if you are interest in read about the hay hall belltow more click the link below
4653,stoll recit the first and the fourth bell skip 2 and 3 http ublib buffalo edu archiv build chime html
4654,clean hous in 2014 vote progress vote blue
4655,with all due respect adam
4656,repeal and restart is unaccept
4657,repeal it period
4658,thank you for work on thi critic issu
4659,simpli a great job
4660,well done
4661,the univers is an amaz place where everyon wish to be abl to get to know one day
4662,you are not my congressmen but i saw you on the pb news hour last night
4663,i say touche'
4664,and i wonder whi your not my presid
4665,ashley tisdal would be amaz to see you as eva tramel on crossfir tv seri
4666,what u think
4667,3
4668,hey busta from mexico citi
4669,you deserv it
4670,and thank you as well the encourag here ha kept me go
4671,if you support and feel thi program work so well whi do you not support expand it to cover everi man women and child in the countri
4672,support h r
4673,676
4674,sweet
4675,thank for the follow and for the compliment
4676,your look pretti strong too
4677,instead of reform how about someon use the mass between their ear and use common sens
4678,let peopl be abl to make an execut decis
4679,i get to do that at my job and it usual work out
4680,congratul vincent
4681,he still said stupid sexist stuff
4682,you look great
4683,thank for support such import work
4684,ms bass how can we get robert cruikshank' messag to the presid we want him to lead the fight
4685,hope some other network pick it up
4686,i'm go to miss thi show terribl and i don't want the cast and crew to leav portland
4687,we love you guy here
4688,best of luck to you
4689,brilliant
4690,thank you
4691,you deserv them all
4692,keep up the great work
4693,i like be a home boy
4694,i object to the legislatur raid yet anoth retir account with the possibl combin leof 1 with tr 1
4695,bang bang
4696,well name
4697,thank for be an awesom human
4698,brilliant and provoc present
4699,great
4700,had to follow after that twh comment
4701,crack me up
4702,happi belat birthday alan
4703,and a thank you to you maria for all you do
4704,lick my salti ball millenniumfalc0n
4705,i prefer uncertain freedom to the bond of the tyranni of govern care
4706,how about unleash the insur industri from choke govern regul that are make it unafford
4707,there is no futur in the govern take over a huge chunk of the american economi
4708,do you expect a 12 year old who wa rape to carri the child
4709,it' quit alright you clearli kickass
4710,congrat on the oakland tribun endors as well
4711,that i didnt want her dog to sleep in our bed
4712,i am so proud of my congresswoman jackson lee as alway keep up the great work much love to you from san antonio tx
4713,thi guy is scari smart and enabl
4714,if we could spray that on tumor and cancer cell we could eat our problem rather than irradi them and weaken us further
4715,if it wa done right it might even get better outcom than surgic remov larg cyst
4716,tag your it
4717,unfortun trump is drain the swamp onli to build a bigger one
4718,look at hi cabinet pick
4719,thi sound most excel
4720,i have miss watch you
4721,your wisdom is need and so is your polit acumen
4722,howev i realli like tucker too
4723,come back and visit
4724,he' gonna get a lot of peopl kill b 4 thi is all over
4725,thank you for make sens in a commit about percentag of the big pie dear bless
4726,i agre with the speaker' opinion
4727,no one is perfect
4728,so it is import for us to embrac our vulner
4729,wish she wa in ohio mayb i should just move to w va
4730,thank for the follow back
4731,haha and then scotti tell him to sit your ass down
4732,you gotta love spike for hi love of the game and team tho
4733,d
4734,david i hope you'r consid run for the senat
4735,sweet co co i love u
4736,go for it kid do it just like i did love it
4737,i'm proud of you ami and your coach is too
4738,thi is truli amaz technolog
4739,i can't wait until peopl that are anim in thi way actual touch the ground
4740,you should be stand up for all women
4741,support plan parenthood aca social secur and medicar
4742,we don't have your cadillac retir and health insur
4743,that should be cut also
4744,i'm pull for cy ranch which by the way is in your district also
4745,also the one with the best name
4746,roll right off the tongu
4747,ah the good old day as professor kopi photo
4748,you can have roman
4749,i want seth rollin
4750,oh dear god
4751,not track better
