,sentences
12948,also gotta get your about me section fill out
12949,let peopl know what your about and what you wanna achiev
12950,i way almost a goner at age 6 month now i am age 60 in august a onli son
12951,no problem
12952,and thank for the prop
12953,i'm realli like thi site veri fluid and easi to catch on
12954,d
12955,good job he play realli well happi to see isner play a great match
12956,he is my favourit player
12957,should have been fire a long time ago
12958,we all knew he wa dirti
12959,now let him pay for hi action
12960,pink is a pretti color for him
12961,thi talk remind me to be grate that while my countri is not perfect there are still mani good thing go for me
12962,i am thank
12963,pleas sir
12964,we have ask mani time for you to cosponsor h re 752
12965,we have 159 cosponsor now so say ye and join your fellow congressmen
12966,thankyou
12967,saw both game michigan win way to go
12968,good
12969,i hope you support regim chang in iran
12970,reek it rhyme with leek
12971,thank diana for share thi experi
12972,it taught me wht to focu in life
12973,ye i'v been readi sinc i first heard about it
12974,i'm alway readi for a new dean koontz book
12975,come to seattl for comedi alonzo
12976,we miss you
12977,i'm get a stand up desk in a coupl of week as part of an offic remodel it might sound crazi but that the one thing i'm most excit about
12978,i think thi wa one of the most beauti talk that i have listen to on ted
12979,amaz
12980,i like how u speak ur mind and tell the truth
12981,condol to the family'
12982,babi could have accident catch an axe and throw it into the camera man
12983,that would suck
12984,welcom to my side of the world
12985,nobodi live there becaus it frig cold
12986,cute but grow up you chang into drop dead gorgeou
12987,it possibl
12988,i just think that it ridicul that peopl are so sue happi
12989,the famili of the shooter were probabl just as upset by the tragedi as the famili of the victim
12990,i feel profoundli move and chang by jill' talk
12991,i both laugh out loud at her recount it what a natur stori teller she make if onli all motiv speaker were as interest and wa move to tear with her at the end of it
12992,thank you jill for share your amaz stori
12993,you speech is so great as we know the econom condit of china are much improv thi year but now the way of develop economi is go harder and harder yeah as a chines hope china will grow stronger
12994,thank you my darl friend
12995,xoxox
12996,lol well keep me in mind if the fight ever happen
12997,i alway dig a nice reddit mma bet
12998,selfi video in gener weird if your not the subject of the video
12999,hey check thi cool stuff out but im obsess with myself so here my face too
13000,glad too see your in washington do your job which is basic noth
13001,if you dismiss bill o'reilli i will no longer watch your channel
13002,i work dure the day and your pm line up is where i get my real news
13003,again if bill o'reilli is fire i'm done with fox news channel
13004,long time ago i also had to go through thi good luck
13005,whi so beauti louisa chirico
13006,where' my invite
13007,semper fi ladi great job and much success in the futur
13008,congrat
13009,hope you do great thing in congress
13010,you'll get there
13011,you'r take graduat level pole danc class now
13012,they'r probabl concern about have their million dollar salari reduc now that health care is attain for all american
13013,and see all the slacker at work
13014,right hemispher we insid the me
13015,left hemispher me insid the we
13016,all in one and one in all
13017,they both make our live beauti
13018,it is import that all of us take respons for ourselv and our problem that we quit the current overspend nonsens and that we quit put massiv debt on babi who won't even be born for decad
13019,i repeat pleas get rid of thi massiv and harm spend
13020,yeah i wa wonder on how the muscl would chang with the increas endur
13021,thank
13022,p s
13023,she ha blond and black and grey and blue hair
13024,i think that' kinda cool
13025,thi is truli awesom talk
13026,about to join the 50 so inspir by your sled trainer photo
13027,had to follow
13028,i didn't doubt that for a minut
13029,accord to hi girlfriend sister twitter what a credibl sourc
13030,thank for the follow back
13031,i'm sure they'll recov fine
13032,great workout by the way
13033,unit state of space
13034,congrat jessica
13035,trailer look great
13036,let' trust north korea as they are not a nation of terror say the present us unit nation rep mr rice who own how mani share in the canadian pipelin
13037,happi thanksgiv to you too david
13038,professor benjamin is amaz
13039,i'm am veri glad to have the opportun to learn from him at harvey mudd colleg
13040,it' her time now
13041,rank 205 a few month ago and now in the top 50 with thi win
13042,i miss chat with you in the newsroom whenev you pop in
13043,have a great interview today
13044,i realli can't believ tat it isn't prerecord gr8 work
13045,welcom in the group don't forget to share in the group you fav flavor
13046,just found out you vote in a separ action to strip the birth control benefit from the afford care act
13047,realli ann you need to stay out of our womb and our bedroom
13048,thank you congresswoman bass
13049,keep up the great work
13050,everyon endors your candidaci
13051,you'r the absolut best
13052,thank you congressman
13053,oh no evah what happen how did you hurt yourself
13054,i hope you get better soon
13055,i agre stephen is realli funni with some comeback hi stage cocki ness there are a few gem but a lot of time im actual more interest in what the guest ha to say
13056,you'r most welcom
13057,and yeah i'm post on 4 month old statu updat
13058,congrat alway to patti
13059,she repres the peopl of wa as did my buddi scoop jackson
13060,georg i respect refer you to 1 on thi postal servic fact list sir
13061,http about usp com who we are postal fact top 10 thing to know htm
13062,vote cast in your direct
13063,whi are you still here
13064,i thought you had creat your own uk polit subreddit
13065,with blackjack and hooker
13066,our compani prepair to offer the cost price for thi project so peopl can get a pure electr car below 18 000usd rang of 250km fulli charg time onli 25 minut batteri cycl life is 2400 cycl that mean 0 037usd per km
13067,i just messag you like a week two ago
13068,couldn't poke your head in there
13069,jk
13070,i appreci it i'm alright
13071,what' new with you
13072,thank' for your time today
13073,we realli enjoy speak with you
13074,where i had a choic to play field hockey or intra mural my daughter have play ani sport that interest them and went as far with it as they want
13075,it' time for a titl ix program for gender equiti in all area of our live
13076,go titl ix
13077,i love thi idea
13078,join
13079,that make sens
13080,i knew the first three were veri close like within a week
13081,didnt rememb im2 in so close too
13082,that would make sens
13083,but with homecom shift time for everyth doe it realli matter anymor is the question haha
13084,that anoth stori altogeth
13085,thi is so brilliant
13086,i love her
13087,will share thi site
13088,com to st loui lhhh
13089,ms gilbert' talk inspir me to write thi essay http www torahdinn com eton p 232
13090,thank you for be my muse of the moment
13091,leon
13092,love your hair bethani
13093,link data is a good idea but equal import is link understand
13094,tbl mention data standard and standard format but he doe not mention standard for metadata or document
13095,the intern commun is way ahead on thi
13096,can the u s catch up
13097,thank debbi
13098,happi and healthi new year to you too
13099,you are such a winner
13100,hug
13101,randi and rube www facebook com massrandal
13102,with the right soil thi is anoth great agricultur altern crop for florida and the florida farmer
13103,i love thi talk
13104,i have also wrote a book on the subject call agil kid publish in 2010 introduc agil into our famili step by step in a practic manner
13105,enjoy shirli ronen harel
13106,thank man
13107,just got back from a quick bike
13108,i use to alway smoke and then work out and i wa never a unhealthi munchi eater
13109,but now i drink and drunk awesom roy eat fatti food and sleep
13110,i just cant wait till i can smoke again
13111,until then ill just stay on thi bike
13112,el color negro te cae perfecto
13113,yeah
13114,one of the most interest talk in ted
13115,womanindota 2014 11 07 03 43 utc faceless void we see ur vagina bele to death thi messag wa creat by a bot contact creator sourc code
13116,i thought that ribbon in the background wa liik meant against her
13117,too bad california you have big problem and still vote the same screw up in
13118,insan
13119,make me want to learn chines we the west need to reconnect with china on a person 1 to 1 relationship way
13120,while we still can
13121,the cyber attack and build up of militari are all the warn we should need my clan
13122,ben ben zu
13123,haha def deserv that appreci the follow as well
13124,haha may bad well thank for be so help
13125,i can now make some appropri changea to my diet and lifestyl
13126,hmmm n and s korea
13127,i'm just wonder who start thi divid and rule strategi in the first place
13128,china
13129,imposs
13130,all of these pipelin are go to take bitumen dilbit actual even more toxic than crude to 'tidewater' where they will dump it onto oil tanker that will take it down to the gulf for refin
13131,none of it is for use in canada or for refin in canada
13132,you have a show that last more then 1 season
13133,no way
13134,lol lol
13135,kid i am look forward to it
13136,im still pull a nice 80k on target dummi
13137,i love thi idea
13138,would love to know more how to start build one
13139,the idea of fresh live food total appeal help guard against food wast go off and the reduc impact on the environ
13140,chick flick becam popular among women not becaus they were lame stereotyp of women but becaus women realli did want chick flick
13141,how would the domin of social media by women chang that
13142,will it chang what they want
13143,i like the way you check thing out matt
13144,you are do a great job
13145,includ the commun and surround area is a veri good thing
13146,help to get good feedback
13147,help make your job easier and serv the peopl fairli
13148,you should go back for the fandango
13149,it a lot of fun
13150,i will say your adventur give lot of idea
13151,marvel photo
13152,when conserv like you win we all win
13153,go steve go
13154,watch season 10 marathon great episod
13155,love you as a demon in the begin your hair look great but u scare me with the mark caus you just didn't care anyon or yourself
13156,glad to see you back
13157,whew
13158,you are one good look man
13159,awwwwh
13160,thank u
13161,u too
13162,u too
13163,you'r veri welcom
13164,thank for the remind
13165,just shot myself an email don't wanna mess with thi web browser anymor today
13166,glad to help
13167,i am not optimist that most peopl will get the gist of thi talk
13168,thank you
13169,and thank much for the follow
13170,tammi whi don't you help us with the crime go on in our legisl
13171,they are tri to cover up all walker illeg do and stop veteran and colleg student from vote
13172,keith ask the state to establish a money for muslim program so they wouldn't be attract to radic islam right after 22 of them somali' defect and join them
13173,thi is typic of dem solv problem with buyout money and come from someon who doesn't have a clue what assimil mean
13174,hola
13175,jugando a ser grand
13176,que bien
13177,dunia te imagino ahi jugueteando con ella amorosa y linda como mam
13178,deseo pase un bonito y maravilloso domingo llenisimo de amor
13179,angelito bello
13180,law enforc put peopl live on the line everyday to protect their job gang member with badg
13181,you win inan comment of the day
13182,inan as fuck man
13183,oh geez
13184,hardli a legend but certainli an old timer lol
13185,i wa on fito when it wa uphil to school both way
13186,i love make new friend here and find way to keep inspir
13187,the honour is mine
13188,watch it thi morn but hey it' the bryan bro so they'r basic unbeat at doubl
13189,rock that hair do in wimbi
13190,you go bm
13191,damn i want to see thi
13192,awesom job josh what wa it like to film
13193,you still kill it dude
13194,of cours motiv
13195,an excel speech captiv and inform
13196,thank for the follow back
13197,yeah fitocraci seem more bias toward strength train
13198,i think their point system need a complet overhaul
13199,you made us all veri proud
13200,keep up the hard work it' pay off in your perform
13201,peopl like you truli disgust me
13202,elfin forest in north counti san diego amaaaaz hike
13203,american idol judg super star legend paula abdul you rockedth world with cool r'n'b stuff late earli 90' such as straight up opposit attract my love is real cold heart blow kiss in the wind rush rush
13204,one of the veri few rapidli dwindl politician
13205,i thought thi video wa veri good
13206,i am go to share thi video and i hope if find that right person that need it
13207,for what i do right now in get peopl to read again in my citi thi video wa someth to keep me motiv on my goal
13208,vote for debbi gari and mark
13209,can you believ it
13210,dinner at the white hous the hous built by african slave i'm sooooo proud of you potu and the cbc
13211,ive alreadi seen a ton of cardin fan around town and i dont even live near wrigley
13212,it gonna be crazi
13213,if she can't get bill through to help louisiana voter what good is she
13214,i am now watch and thank you for actual read my post
13215,like the option to block invit from a given person after they invit you so mani time in a row kind of like the option to boot a player after so mani betray is in a lot of game
13216,or the option to turn off incom invit entir mayb
13217,thank you rep pingre
13218,final we have someon repres main with the common sens we mainer expect from our elect offici
13219,great ted talk
13220,i agre with hi comment
13221,great job congressman johnson
13222,eleg
13223,stun
13224,thi is a look that command respect
13225,amaz talk
13226,inspir a lot
13227,i couldn't avoid cri in the end
13228,i can
13229,we can
13230,self efficaci that' quit a profound concept
13231,i'll give you a great cheat week
13232,wow thi wa so power and brought me to tear just watch it
13233,becaus i too am face of m s
13234,and i have alway said that i have m s
13235,but m s
13236,doesn't have me
13237,chromosomon link in lol
13238,come to minneapoli
13239,we love you here
13240,wow that just convinc me that idea that may sound a bit too unlik to implement in the first place are actual worth while
13241,no small feat
13242,good work thank ami
13243,so puls is more underus than tachanka
13244,okay
13245,can't wait
13246,go eve go
13247,no problem
13248,good to see we'r both put in the hard work
13249,i like them both too i wa a big fan of mathilda in echo a shame she not better in hero but i believ i can make her work
13250,do they occur in natur
13251,if not then don't eat them
13252,to gym
13253,you'll feel better when ya do
13254,work the sore muscl
13255,aloha brian
13256,but not with toxic danger geotherm geotherm frack right
13257,no on syria no on gmo pesticid poison of hawai'i
13258,no problem i sure will
13259,d
13260,off the wall and brilliant as usual from rive
13261,bravo
13262,i'm so excit for thi
13263,great idea
13264,great goal
13265,great person
13266,internet wont solv the problem in the world although internet is the tool we can use to share our problem and togeth find the solut
13267,let work togeth to make thi world connect
13268,let work togeth to make thi world a better world
13269,happi friday lourd
13270,had a great time visit with you tonight
13271,yeah and what about obamacar
13272,do anyth to repeal it
13273,didn't think so
13274,whi would it be austin chang shit
13275,thi is my favourit workout programm ever
13276,listen to your custom
13277,mwwahaha aspetta che ricomincio come si deve a correr
13278,im clearli in the minor and i get that
13279,i still lurk there a lot
13280,ok mr dee
13281,you'v convinc me i need a new os
13282,i'll instal penguin'
13283,serious now we got to abandon the idea of human is abov the anim
13284,we are on the same boat
13285,what happen to them will happen to us
13286,i enjoy thi
13287,love that he ha not stray from pb
13288,wahooo awesom beauti 3
13289,a solut in search of a problem
13290,are you seriou
13291,of cours a voter id law would suppress turn out
13292,if you'v have peopl who can't prove who they say they are whi would they show up to vote
13293,marsha it would be comfort if he would keep the strength and power of our arm servic
13294,love it onc again
13295,no problem
13296,thank for follow back
13297,good win it wa nice see u here in jamaica make sure to come back next year
13298,bad skelet joke give me a femur
13299,zoe
13300,you are an exampl of dedic and courag
13301,thank you
13302,do we realli need 8 separ post about thi
13303,great talk monica with such a time and import messag
13304,have share it with my group of 15 year old girl guid i think they especi could benefit from your messag on the power of compass onlin and our respons not right of free speech
13305,hope they will all becom upstand
13306,vote for you and ms landrieu today as well
13307,best of luck to both of you
13308,halperin you'r such a right wing tool
13309,wcw you are beauti
13310,of cours
13311,to be the best you have to be realli hardwork
13312,realli pete defend black panther
13313,tri say the bias comment al sharpton say to defend white you will be off the air
13314,when i do i get call a troll
13315,pleas help lee zeldin in ani way that you can
13316,not onli is lee the right man to repres us in the ny state senat he is the best man to repres us
13317,veri interest
13318,most difficult problem have simpl solut
13319,nanci we love you all the best ''you will be on your speaker seat after the 2016 god bless you
13320,congratul soror
13321,keep up the great work
13322,squat heavi but squat safe
13323,congratul to benson
13324,good luck to you and the canyon del oro hs tucson academ decathlon team at nation in april
13325,yeah but we do know what she said he end with
13326,ye
13327,all my friend and famili some do not get it and other do
13328,deepest sympathi to hi famili and friend prayer
13329,so glad u r have such wond experi
13330,you shouldnt submerg a fresh tattoo
13331,log it as someth similar like log press i think that' what it is anyway or ask for help in the forum http www fitocraci com forum or ask the peopl in the strongman group http www fitocraci com group 538 about
13332,lourd duart i saw thi beauti stori
13333,truli amaz and sad at the same time
13334,you did a wonder job on thi
13335,thank you
13336,chill just insan
13337,the whole stori
13338,hello
13339,yay choco
13340,time to get down to busi
13341,now let' do thi
13342,o
13343,monica as a nurs grad you should definit attend thi health forum
13344,i wish cmr could attend it too
13345,it should be requir of everi elect offici and everi health care worker in the area
13346,http www2 provid org spokan news news releas page tr reid forum aspx
13347,you'r do great vania
13348,keep it up
13349,look forward to see you play at the u s open again later thi year
13350,when will you finish ride the storm
13351,we'r all wait for christoph snow
13352,compromis
13353,stop blame each other and tri someth that work
13354,alreadi did i know who is good fot us
13355,just level up
13356,back in the game
13357,respect sir i am an kashmiri pandit from jammu and kashmir just want to say a big thank to u for ur effort for introduc resolut on kashmiri pandit in us hous of repres
13358,defin i'll be tune
13359,gd luck
13360,i don't see your name on the list of lawmak who will not attend the inaugur
13361,how you can support thi man is mind boggl
13362,what a disappoint
13363,congratul to you and luci
13364,it wa amaz match
13365,i can so relat to thi speech but is she from scandinavia
13366,she is talk abt other people' doubt in you jelousi and envi typic swedish
13367,i didn't think american would say that
13368,congrat elizabeth thi dome book wa a success as all your book will be
13369,i so wish he would move to kentucki congrat again main
13370,lost respect for you mark
13371,hillari is not capabl of leadership nor of foreign polici direct
13372,you'r too great jane
13373,hope you'll be abl to come back for the us open i'll be cross my finger
13374,good luck b
13375,and you know effect bankrupt the state
13376,well your is actual crumbl
13377,om just got push out
13378,oh i would love that
13379,it took me and dad mani run befor we found our groov
13380,of cours dad is nice and let me stop whenev i want to
13381,what kind of dog is gambit
13382,rep lofgren pleas read thi well thought out post and think of way to improv your propos aaron law http www volokh com 2013 01 16 the crimin charg against aaron swartz part 2 prosecutori discret
13383,dear janet i like your stori and artwork so much
13384,especi the amaz public art instal 1 26 project
13385,realli hope that it could be adapt in shanghai the citi where i live now
13386,you'r welcom _ glad you follow back eh
13387,hmm
13388,not long ago i heard of equal liquid repel coat be in develop by the condiment industri for item like ketchup bottl i wonder if it is the same stuff
13389,muhammad ali wa truli the greatest of all time
13390,i feel confid he is in a better place for all of the contribut he made to societi both insid and outsid of the ring
13391,i miss you champ
13392,thank you and for the follow back look forward to see your progress
13393,thank you
13394,you too
13395,kick ass
13396,d
13397,thank god you didn't do paleo for thanksgiv
13398,that would be sacrileg
13399,agre
13400,and now i'm beat him
13401,there will never be peac as long as capit reward the war industri the most profit industri on earth
13402,thank you bono and sen dick senat dick durbin for all you do for the poor and the hungri
13403,join us www result org
13404,we onli get to keep what we give away
13405,rev
13406,michael bernard beckwith thi life it' not about you
13407,good idea on video of my form all i'v been look at is other people' form
13408,i'll do thi in thursday
13409,i think real educ of creativ should melt in everi class in school
13410,we don't make time for think creativ
13411,school must place student with creativ
13412,what a wonder talk
13413,truli inspir
13414,ye teresa i watch onlin yesterday as the launch wa postpon
13415,sorri that the space station won't be get those suppli on schedul
13416,glad no one wa injur
13417,i teach in san fernando and i'm show thi to my class
13418,let' get defiant and eat strawberri
13419,yeah right
13420,thank for help me in express my thought
13421,have a success workout
13422,wow lourd were you even born when that movi wa made
13423,i found your present to be veri inspir
13424,love the concept of 'spiritu technolog '
13425,so doe seth write these or is it go to be someon els bc i think it kinda lame if he doesnt i want to help didnt get seth
13426,congratul senat cantwel
13427,overal i am veri impress with the whole idea and i truli believ that the challeng is to first accept and love ourselv then we will have the power to accur interpret our religi script and feel compassion toward the other evil will alway be rel and good will prevail
13428,well consid were talk strictli about a game laptop i believ it safe to assum you want your laptop to play game
13429,nobodi is go to be tri to shove a game desktop down the throat of someon that want a simpl laptop and doesnt play game
13430,your argu just to argu
13431,yay can't wait for grimm to be back on
13432,look silli to me
13433,poor choic for background
13434,distract from an otherwis great photo
13435,but kingsman is a shit movi
13436,thank man
13437,awesom run you just did
13438,congrat d
13439,strong confid honest you go girl i'm on board
13440,hope you feel better soon
13441,love it too much
13442,yahoo
13443,atta boy john
13444,go team
13445,nice articl
13446,first time i'v seen you refer to as cappi
13447,i hurt my back and also fell off the wagon
13448,i am get back on track thi week by hit the gym and get pt session
13449,thank for notic my absenc
13450,from the gulf stream to the bloodstream the video bp doesn't want you to see
13451,http www youtub com watch v 6drasixnfaw
13452,great pic shelbi
13453,good luck from me and everyon at marina sport medicin
13454,thi is such excit promis research
13455,such potenti onc thi move past obstacl and forward to trial phase
13456,that' brilliant if it is use in real surgeri
13457,orgasm for everyon
13458,you go beast
13459,pleas be safe look like you are have fun
13460,good for you
13461,keep it up and safe ask a lot of question on fit and research the answer mani time over
13462,be the best
13463,today you can regist who you want to steal from you
13464,i am still in shock
13465,these have been the happiest day my famili and i have had in 6 year
13466,soooooooo proud of you and zink
13467,now to replac tester and bullock with good strong peopl
13468,good luck in dc and give our love to gowdi he' anoth true american
13469,i love thi talk
13470,it wa veri entertain and veri insight into mysteri of well mysteri
