,sentences
4562,lookin at you lg 25um65 p with your 2560x1080 and 190 price tag o
4563,great talk
4564,well do suzanne
4565,preserve your language preserve your culture
4566,congresswoman zoe lofgren thank you for your fearless leadership to fight for these injustice
4567,we know without a doubt that there be a cover up or they would not have go on tv say it be a utube video
4568,then have the man lock up for make it
4569,try to put the blood from their hand on his
4570,they be despicable
4571,i have a splashdown grand turk hat that i get in october
4572,do you get to pillory beach
4573,if you walk along the shoreline you can find your own private beach and some of the most beautiful shallow water snorkel around
4574,why don't you show dinero with bill clinton
4575,there be videos out there
4576,space base solar power can easily solve for the world's energy problem and with no emission of any kind it will solve for global warming
4577,we just need to invest in this tech before it's too late
4578,it be a long day thank you although i'm devastate by the abortion amendment
4579,burstein give a simplistic view on the complexity of creativity
4580,interest
4581,thank you sweetie stephie 3 mwah xxxxxxx
4582,in this talk dennett describe the living cell of the body as unconscious robot
4583,can someone point me to evidence support this view
4584,i would also be interested in evidence that do not support this view
4585,thanks
4586,fair statement
4587,care to share the show which top your list
4588,just curiosity of course every person be entitle to their own opinion
4589,vote cast in your direction
4590,the speaker be a realist
4591,i hope you have a wondeful thanksgiving too
4592,you be the greatest
4593,thank you for follow back
4594,look forward to see all the awesome thing you will do
4595,we miss you when you're go but we assume you're just so busy with work out and life that you can't get to the computer
4596,d
4597,hope you take time to relax and enjoy family too
4598,thank you for your leadership
4599,so cool
4600,i wish these kind of technique to spread all over the world very soon
4601,show these tool to develop country might help i think it may increase thise children's creativity
4602,just embarrass
4603,american be laugh at this stupid ad
4604,i have come to believe that 'coming true' be not the only purpose of a dream
4605,its most important purpose be to get us in touch with where dream come from
4606,where passion come from
4607,where happiness come from
4608,even a shattered dream can do that for you
4609,amaze
4610,yes and you dont see this again until diii where people have some skill but be humble enough to realize that they be not the best so it create for some really friendly relatively high level game
4611,supervision be all about angle
4612,yes this be interest i think edward tenner speak clearly and with purpose
4613,no problem thanks for the follow as well
4614,congrats cant wait to see it
4615,i also have a tennis dog
4616,photo
4617,then i have be watch this for the 3rd time today yet i be not willing to start do the work i suppose to do 1 month ago
4618,awwwwwwwww
4619,p nice draw love the panic monster
4620,same it make me extremely sad as well
4621,it remind me of the innocence of childhood
4622,its an image of a simpler time
4623,that hat be red carpet worthy
4624,i be very impressed with this presentation his perspective on education
4625,no 2 child be the same should not be teach as such
4626,this have help to reaffirm my opinion against the common core standard our national state board of education be try to implement
4627,incredible awe inspire stuff
4628,she should have get all the medium coverage that oscar pistorius get last summer
4629,how about pass the unemployment extension immediately
4630,money should help american family before be send to the ukraine
4631,please support euc
4632,hillary should take a page from her husband call it the one hundred thousand new babysitter on the campus program
4633,what be you do to stop illegal immigration
4634,good reminder from our congresswoman matsui who we're lucky to have
4635,thank you very much for all the great thing you be do for us congresswoman maxine water shot out to you from all the resident of public housing esp mar vista garden
4636,you're very welcome
4637,thank you for the prop
4638,it be interest to know that we can cheat ourselves by body language
4639,sometimes it be necessary for us to do that especially when we need to pump ourselves up
4640,i love the part of withhold the pay of lawmaker if a budget isn't pass by april 15
4641,something like that should be permanent
4642,the way that congress be show us that they be ready for a serious conversation about immigration reform be by have stephen colbert testify in congressional committee in character no less
4643,awesome talk thank you
4644,wow 11 hour of bellydance
4645,crazzzzzy
4646,the mother's life matter more than that of an unborn
4647,your care priority should be toward the mother
4648,i miss it too
4649,hopefully i'm feel well again this evening so i can reunite with it
4650,how great that with some slight change your body can become alltogether more healthy and improve brain function
4651,it be really really inspire now i be 20 year old and i be start to think of the way to spend my life and the way to add more meaning to it this speaker must have experience a lot of funny thing which i really admire
4652,if you be interested in read about the hayes hall belltower more click the link below
4653,stoll recite the first and the fourth bell skip 2 and 3 http ublib buffalo edu archive building chime html
4654,clean house in 2014 vote progressive vote blue
4655,with all due respect adam
4656,repeal and restart be unacceptable
4657,repeal it period
4658,thank you for work on this critical issue
4659,simply a great job
4660,well do
4661,the universe be an amazing place where everyone wish to be able to get to know one day
4662,you be not my congressman but i saw you on the pbs news hour last night
4663,i say touche'
4664,and i wonder why your not my president
4665,ashley tisdale would be amaze to see you as eva tramell on crossfire tv series
4666,what u think
4667,3
4668,hey busta from mexico city
4669,you deserve it
4670,and thank you as well the encouragement here have keep me go
4671,if you support and feel this program work so well why do you not support expand it to cover every man woman and child in the country
4672,support h r
4673,676
4674,sweet
4675,thanks for the follow and for the compliment
4676,yours look pretty strong too
4677,instead of reform how about someone use the mass between their ear and use common sense
4678,let people be able to make an executive decision
4679,i get to do that at my job and it usually work out
4680,congratulation vincent
4681,he still say stupid sexist stuff
4682,you look great
4683,thanks for support such important work
4684,m bass how can we get robert cruikshank's message to the president we want him to lead the fight
4685,hope some other network pick it up
4686,i'm go to miss this show terribly and i don't want the cast and crew to leave portland
4687,we love you guy here
4688,best of luck to you
4689,brilliant
4690,thank you
4691,you deserve them all
4692,keep up the great work
4693,i like be a home boy
4694,i object to the legislature raid yet another retirement account with the possible combining leof 1 with trs 1
4695,bang bang
4696,well name
4697,thanks for be an awesome human
4698,brilliant and provocative presentation
4699,great
4700,have to follow after that twhs comment
4701,crack me up
4702,happy belated birthday alan
4703,and a thank you to you maria for all you do
4704,lick my salty ball millenniumfalc0n
4705,i prefer uncertain freedom to the bond of the tyranny of government care
4706,how about unleash the insurance industry from choke government regulation that be make it unaffordable
4707,there be no future in the government take over a huge chunk of the american economy
4708,do you expect a 12 year old who be rap to carry the child
4709,it's quite alright you clearly kickass
4710,congrats on the oakland tribune endorsement as well
4711,that i didnt want her dog to sleep in our bed
4712,i be so proud of my congresswoman jackson lee as always keep up the great work much love to you from san antonio tx
4713,this guy be scary smart and enable
4714,if we could spray that on tumor and cancer cell we could eat our problem rather than irradiate them and weaken us further
4715,if it be do right it might even get better outcome than surgically remove large cyst
4716,tag your it
4717,unfortunately trump be drain the swamp only to build a bigger one
4718,look at his cabinet pick
4719,this sound most excellent
4720,i have miss watching you
4721,your wisdom be need and so be your political acumen
4722,however i really like tucker too
4723,come back and visit
4724,he's gonna get a lot of people kill b 4 this be all over
4725,thank you for make sense in a commitment about percentage of the big pie dear blessing
4726,i agree with the speaker's opinion
4727,no one be perfect
4728,so it be important for us to embrace our vulnerability
4729,wish she be in ohio maybe i should just move to w va
4730,thanks for the follow back
4731,haha and then scottie tell him to sit your as down
4732,you gotta love spike for his love of the game and team tho
4733,d
4734,david i hope you're consider run for the senate
4735,sweet co co i love u
4736,go for it kid do it just like i do love it
4737,i'm proud of you amy and your coach be too
4738,this be truly amazing technology
4739,i can't wait until people that be animate in this way actually touch the ground
4740,you should be stand up for all woman
4741,support plan parenthood aca social security and medicare
4742,we don't have your cadillac retirement and health insurance
4743,that should be cut also
4744,i'm pull for cy ranch which by the way be in your district also
4745,also the one with the best name
4746,roll right off the tongue
4747,ah the good old day as professor kopi photo
4748,you can have roman
4749,i want seth rollins
4750,oh dear god
4751,not track well
4752,i would never vote for cory gardner and talk about slandering he be really do a job on
4753,hope it heal quickly
4754,if youre not too tired after that ill be down by the creek later for some good ol skiprock
4755,well that oughta take the wind out of some republican idiot candidate
4756,thank you you aswell
4757,i don't do crossfit but look at your workout and see some thing i might try and do
4758,not so
4759,angela corey be know to charge 17yr old as adult
4760,tom gartland david oppose amnesty and will not vote for a pathway to citizenship or any public benefit for those that come here illegally
4761,you can find david's principle for immigration reform on davidrouzer com
4762,this be very true
4763,he should at least be able to handle his own clothes
4764,it be sort of unclear from the op if he be leave all the clothes or just hers
4765,that like all of your post make no sense
4766,if god be pro life then why do we die
4767,i agree with you that it be awful that people will not feel force to work at a job they really dislike to get health care
4768,support hr38
4769,this be our chance let's get it do
4770,haha yes another ontario outdoorsy love mfr wfr d i get my wfr at http www cwmt ca its a pretty good price for them and its mostly base out of ontario
4771,kevin_p21 thank you for the follow back
4772,have a great day
4773,its the presence of kim kardashians cleavage on the cover thats her issue
4774,happy easter to our soon to be congresswoman norma torres district 35
4775,thanks for the follow return the favor
4776,my bfast today be 2 egg and then a smoothie an hour later
4777,pineapple strawberry blue and raspberry with oj
4778,already hungry for lunch but i need to space it out a little bit or else i'll run out of food at work haha
4779,westerner cannot and should not attempt to script arab thought
4780,but they can support a return to the standard of critical thinking and open inquiry that once characterize the arab world
4781,cynthia schneider intolerance and censorship in the arab world
4782,amen glory to god
4783,so true
4784,i vote for will
4785,usn 1975 1997
4786,hollywood phony
4787,i think most of them be self centered egotistical fake people
4788,brene a good friend recommend me to watch this and i really enjoy it
4789,thanks for share your story
4790,i be go to take this with me
4791,martin
4792,thank you congressman lance for yours and your wife thought and prayer
4793,these family will find peace know they do not grieve alone
4794,watch u now
4795,keep put preasure on holder they know wat they be do
4796,despite a belated happy 2015 i will love u likewise
4797,a friend to all public service people
4798,kenny i'm very proud of you
4799,keep up the great work
4800,love
4801,aww moxie you can come over for treat any time i'm sure kero and suppi will share
4802,if you get to them fast enough
4803,comgrats re carolyn maloney's status i be honor to be name a fearless trailblazer by the feminist majorit
4804,you be go to hell ed
4805,i can't repost this but i want to
4806,he's too cute
4807,how special
4808,old school issue high demand in action
4809,we have to find effective way to deal with plastic problem
4810,ha
4811,erica yackel dial you have to watch and listen chick dig scar
4812,http thinkprogress org politics 2011 03 29 154368 rep sean duffy complains about his salary
4813,brene brown i'm gonna remember her name her inspiring talk simply sum our human up
4814,i'm gratefully astonish to have listen to this
4815,promise big dream and deliver morsel to keep the dream alive
4816,classic international try and test election gimmick
4817,never see insidious but love josh xx
4818,that's a great article
4819,i'm write my amazon review sometime this week now that i've finish the book
4820,it will certainly give praise but probably not as well write as this stranger article
4821,i will do my best
4822,i can't wait to get this book
4823,i love the odd thomas series
4824,haha
4825,be there a generic 'cardio' option
4826,pi totally have to dig my car out of the snow yesterday that be a workout fershure
4827,npr really be a waste of money some thing do need to lose fund
4828,he be fire up and ready to take on washington
4829,thank you good luck to you as well
4830,i'm good just get finish with a workout and yourself
4831,it seem amasing but i think it maybe hard press to be put into reality just as sid riseh have say
4832,thanks for the prop
4833,a mind blowing talk
4834,it really get me to rethink ourselves about how to be happy and how to live a good life instead of make good wealth
4835,we should face ourselves and expose ourselves to others
4836,only in that way the world will be fill with love
4837,you'll handle it you're nutrition age and chest physiology be all in your favour
4838,interestingly we be the same height and weight and have the same 5rm bench
4839,i can only assume your 5 bodyfat advantage and our 50 age difference give you the edge
4840,great visit to braxton county today with congressman mooney
4841,visited appalachian timber service one of west virginia's best keep secret
4842,so you think it be ok that i pay more tax than exxon
4843,probably not for football
4844,easy one
4845,murderous failure
4846,this be amaze
4847,could it be do the other way round so we could see music
4848,that'd be awesome
4849,no such thing as affordable health care
4850,thank you lynn
4851,curious to know how many new regs have be write in since last friday
4852,no one rich or poor will benefit from this disastrous program
4853,thank you for recognize our state's veteran
4854,oh
4855,oh
4856,giant just hit a home run
4857,yeah thats the vast majority of bike lane thats why i say isolate you need an obstacle even a small one
4858,giggle you're welcome thank you for the follow and congrats
4859,i feel accomplish for have work your finger out hard
4860,haha
4861,sooooo many people say this
4862,i have absolutely no idea haha
4863,you go tim keep on keep on don't giveem an inch you be a shoo in i do believe
4864,oh i see you and my old friend doms already know each other
4865,so you do the visual effect
4866,do you have any involvement with this shot because thats probably one of the few thing i like about the movie and i think that shot be awesome
4867,what about a code baja red
4868,oh god i just remember live wire and how amazing that be
4869,lol ty ty
4870,feel free to use it all the time
4871,let make it a thing
4872,oh wow
4873,facebook fight
4874,lol i heart how 'les' be troll rep connolly's facebook page and try to 'school' the congressman on what he should be do instead
4875,lol love me some facebook troll
4876,sweet zombie jebus 40
4877,guess it's gonna be a busy weekend
4878,d'awwww thanks for the support man
4879,the citizen of the rest of sacramento should not have to pay the price for what the city and the developer have cause
4880,outrage be and understatement
4881,i urge you representative meng to support your local new york food bank this hunger action month and feed america's fight against hunger
4882,you're so nice to your fan madison key
4883,helo my name be zina asfour i really love your music and think we can work together
4884,my instrument be the piano and i 've be work with several qanun player from the middle east
4885,if you be interested please check the website www ateekmusic com
4886,thank you
4887,i most certainly will
4888,and it be beacuse of their sacrifice and those of their family that i we can enjoy our way of life
4889,i for one will always be greatful
4890,thank you to all those who have serve and to their family especially to those who have give the ultimate sacrifice
4891,im pretty sure xkcd attracts learn people
4892,in fact i be positive it do
4893,and don't make it freak bi partisean
4894,we somewhat have already but we still have time and i sure will talk to her later on about her expectation in a more concrete way
4895,thank you
4896,tenemos q detener esto x el gasto q estonimplica d nuevo y esto viene d nuestros impuestos hay q invertir ese dinero en educacion etc
4897,ya vasta del juego d esos republicanos
4898,ya basta
4899,this be absolutely beautiful
4900,2 good men who put people over politics
4901,stop the abuse of power between dcf and boston children's
4902,thanks for the fb and np
4903,haha no it be not my thing
4904,i think iw be a joke lol
4905,have you ever see rubber on netflix
4906,ive waste plenty of time
4907,you have find your home
4908,very nice but vote for the cronibus bill be a stupid stupid move you show your corp stripe
4909,my pleasure
4910,try to catch back up
4911,mad prop liz
4912,mad prop
4913,quit boost you pokemon
4914,save up
4915,hold onto this lifesaver
4916,unbelievable except it's true
4917,disgust
4918,55 8 sorry me out
4919,you give it to him
4920,news flash joe walsh i have an ectopic pregnancy and almost die the grief and sadness that i endure after emergency surgery how dare you deadbeat
4921,he cannot win
4922,i don't put my bike away for the winter i ride all year around even in the crappiest weather
4923,commonly shorten to why the fuck do i end up here
4924,ftfy
4925,i love the poetry of nature and the perfect balance in her design
4926,no problem
4927,and thanks
4928,pocaterra be the name of a hiking trail that go along a series of four mountain peak
4929,i get slaughter in the ascent haha
4930,hop to go back next month across the country to have another go
4931,personal vendetta you see
4932,we take the tour through steve's office and it be fantastic
4933,drew rock
4934,thanks
4935,it's be a long road but sooo worth it
4936,a republican got something right
4937,haha
4938,lovely to meet you
4939,with a pp like yours i have to follow rock climb race it be then best of luck with all your goal
4940,you're gonna kill it
4941,thank you very much lovely
4942,i have a great day
4943,good work
4944,my wife refuse to apply for it even though she be eligible
4945,so you have no desire to have sex with people you find attractive
4946,you little beast i love it
4947,that woman be pathological and will never ever change her lie about zanny etc
4948,why bother try even
4949,thanks for follow back
4950,look good keep up the good work
4951,support hr38
4952,this be our chance let's get it do
4953,thanks
4954,yours be pretty awesome too
4955,no one work hard for the middle class than senator menendez
4956,i appreciate you
4957,you be impressive
4958,innocence be one of your best book
4959,hi
4960,happy to follow as well
4961,i notice your recent post so check out your workouts activity and i think i really should follow you
4962,you do real solid work i'm look forward to prop comment on more of your activity in the near future
4963,look forward to the 2013 lineup
4964,3 lot of lurve
4965,3 to nelly bean and meatball
4966,amazingly awesome
4967,just another powerful idea that go to show that thing aren't always what they seem
4968,love odd thomas
4969,the casting be perfect and i so appreciate how dean keep creative input thus no incessant cussing etc
4970,great story and great job on the film
4971,enjoy watching this
4972,have to read the book before i see the movie
4973,by golly you have a point saw the flo green track shoe and the stretch pant and hat get it now white blouse and acid wash gray still cool pose though yes
4974,blame the eggnog omelette for lunch
4975,regardless of the position of the pro or anti climate chage camp regardless of whether climate change be man mad or due to natural cycle it be nonetheless an inevitable reality and so we have to act
4976,we're anxious to see you on monday in lancaster
4977,thank you congresswoman colleen hanabusa
4978,well cunty flop be claim to be a troll when shes clearly just desperate for attention
4979,destroy them like i destroy beatles rock band
4980,dear grace yourself be a great achievement for our community already
4981,keep up your great work and happy women's history month to my mom wife sister and daughter
4982,i'm sorry not in annapolis west point and colorado spring
4983,these graduate will know what it mean to have freedom and to preserve it
4984,so sick of all you assholes at fox news repeat the democrat talk point over and over again
4985,unless you idiots get behind trump it's over for the republican party and you will be to blame
4986,go vania
4987,will sneak away from centre court when you be on
4988,well durbin have the latino vote
4989,really glad to hear
4990,can confirm lose 10 lb in a month with this one easy trick that doctor hate
4991,you're a brutal bastard i love it
4992,it be a great game
4993,i'm from indiana but i bleed blue
4994,great game uk
4995,i love the part of withhold the pay of lawmaker if a budget isn't pass by april 15
4996,something like that should be permanent
4997,you know that's right pumpkin
4998,an faq on a government shutdown can be find here http goo gl z1x0k
4999,thanks
5000,it's that time of year
5001,i love see all your butter update
5002,you already know we be watch uncle mac
5003,thanks for all you do for us jp
5004,i be comfort just know you be in dc look out for us
5005,keep up the great work and congrats
5006,ayuda para este pueblo por favor
5007,happy international women's day to you too bitsie
5008,photo
5009,hi darling
5010,welcome to fitocracy
5011,wish you a great time here
5012,simple because he have let himself become a tool of the tea party
5013,a real leader would tell his party's extremists to grow up and govern
5014,i be proud to stand with and for plan parenthood
5015,thank you congresswoman doris o matsui
5016,d 3
5017,tire with low quality
5018,me too and finally i find site to watch in hd here be the site where i watch it game of throne episode 7 the broken man link http bit ly gots6e7
5019,bonnes vacances a me manque de ne plus te voir taper la balle
5020,thanks guy
5021,there's nothing like be back at home and sleep in your own bed
5022,target sell gel pad seat
5023,not a complete fix but better than just the bike seat
5024,i'd like to be able to see if i can sign up but i still can't
5025,congresswoman clarke i be very interested in get involve with the the congressional caucus on black woman girl cbwg
5026,who can i contact to reach out to
5027,thank you
5028,dr erinn tucker
5029,glad you be part of that congress adam
5030,universal background check must be pass
5031,hlep if not hlep me we will die
5032,wow
5033,that's a whole lotta glamour and gorgeousness on pix11
5034,btw you're not half bad either
5035,federal grant to convert ethanol plant to produce biobutanol out of wisconsin crop and ideally hemp would also reduce our dependence on foreign oil
5036,oh yah i'm watch
5037,you look amaze beautiful at the award tonight
5038,that be really deeply awesome
5039,our grandson drew be there
5040,head to see dr and mrs carson tonight
5041,thank you for the welcome
5042,you miss the 4 shot in englewood
5043,just finish innocence another a thank goodness i don't see clear and fog worry that on dog would appear but then
5044,yes they're great
5045,i'm take it real slow though since i run like i'm barefoot in them
5046,it be so easy on the knee but i need to strengthen my ankle
5047,hmmm
5048,interest http www naturalnews com 036689_nsa_whistleblowers_spying html
5049,generally speak rich people loathe public transportation
