,sentences
8970,thanks for the follow back
8971,go to it lois tell the other party to stop bad mouthing you
8972,very interesting point of view about the meditation
8973,i have meditate a few time but i want to know more about it
8974,have this kind of meditation that you describe a particular name so i could search for it
8975,i sign up in headspace but i have no money to suscribe later be there a similar web
8976,why would they want to pass legislation that doesn't oppress woman
8977,hug kiss ashley tisdale congrats on everything
8978,dude braver than i be
8979,you be a very strong young lady very proud of you god bless you always
8980,somehow i get the mental image of bill clinton explain the dancer in the oval office
8981,buckley be before my time but i would love find out more about him
8982,but ala
8983,it's a lot easier to google him than to read a book about him
8984,i'll be here all week
8985,thank you diana for your effort time and hard work
8986,congratulation
8987,thank you for act as a statesman rather than a politician as you can see from the previous poster we can't simply agree to disagree it have to go personal
8988,this generally happen when the opposite view have no fact or actual knowledge on a particular subject
8989,to our favorite lady
8990,lou carmella
8991,if you live closer i'd be happy to help
8992,wow i hope you will get to t his and cut out some of the duplication and the czar particuliarly
8993,the move to socialism be unreal
8994,i never think i would see this day
8995,keep up the good work
8996,thank you
8997,thanks
8998,yeah any flat wall make me happy at this point the possibility for fun be just everywhere
8999,now i've gotta learn parkour or something
9000,be sick and work till 11pm
9001,thank you for stand up for this right pramila
9002,you're the best
9003,nothing that earn point be what the rest of the group be hop
9004,very nice my dear i want to talk with you on massenger
9005,don't worry man i be not gonna be able to hit the gym all week you will leave me in the dust in no time
9006,thank you so much
9007,a voice of reason
9008,absolutely delightful discussion that show so much cultural pride
9009,good for you
9010,keep look for more example of how chinese life have impact the world
9011,wow
9012,i like it
9013,type in sit on my butt
9014,this story just remind me how lucky life be not to waste
9015,you go mom and son
9016,maz be great as iranian european i understand all fun and sad
9017,i tell you be do very well ryan dems be run scar and throw alot of mud
9018,they will say and do anything
9019,you will win
9020,thanks for run
9021,it'll be good to see you in d c you and other's have alot of clean up to do
9022,i be li i be like the nfl less and less you can't recognize our military because they be our real hero
9023,not the player
9024,thats really good
9025,mark halperin be such a republican apologist turd
9026,take 10 people from long term care in eugene or you can donate a ticket to valley river cinema lol jk oh and just for fun katee can show up and join us
9027,this sunday no dialysis day
9028,oh i guess she will be there just not in person
9029,enjoy everyone
9030,great demonstration magic take you away
9031,reminds me of the movie prestige
9032,people like be take away people like to be deceive sometimes in a good way
9033,i be fascinate this message must get out even more
9034,it imply so many improvement
9035,gag me
9036,she will never get my vote
9037,i learn a lot from you thanks for the talk i will look forward to hear from you again in the future
9038,where be you marsha blackburn when bush send hundred of thousand of troop to iraq to search for non existent wmd base on evidence that the cia have inform him be erroneous
9039,one cannot connect anything in this administration with common sense
9040,i find it frustrate that the collected mass of our political representative can't seem to do anything about it
9041,an exquisite conveyance of an extraordinary event
9042,brava
9043,yeah but i hear that they be talk shit about american soccer so fuck them
9044,big baby gandhi become a pharmacist
9045,the medical field claim another asian american rapper
9046,good luck either way
9047,cute story tell it again
9048,love you guy
9049,bresha webb
9050,aww thanks
9051,i think most people be on here
9052,that's why i love it thank for follow back
9053,the democrat view this as another way to use taxpayer money as bribe for more democratic voter
9054,what an interesting personality
9055,i'd really like to talk to him for a while
9056,i really wish this sort of idea be teach or even at least presented to those study to be an educator
9057,wilhelm kill these savage
9058,good to see you at macy s today
9059,outstanding how brilliant of her to share her experience with all of us
9060,truly a golden ted video
9061,amazing talk
9062,hope the promise show in the lab hold up in the field
9063,i tend to give up easily when i realize my limitation
9064,but unlike me she challenge her limitation
9065,her challenge didn't only overcome her limitation but also help others have courage
9066,i hope myself to challnge my limitation and also i want to help others feel happy just like her
9067,i'm on my mobile and its a pain in the as
9068,you're welcome of course love your work
9069,this must be a sign
9070,a sign that there's more humanity in the world than what we think
9071,this must be a call that have to go across all the world
9072,a call to all the people the government and ourself that there's hope and we have the duty to carry it out
9073,great article
9074,sound like a blast you know this show be in english right
9075,too funny
9076,but what's a gollum
9077,i think that accept our fear as a story it doesn't a guide to control our action people can't know what will choose when they be afraid from something because people can't pull away from the kerb logical
9078,hop you get to spend a happy thanksgiving with family in indiana jackie
9079,same voice as always
9080,she could laugh and it would still sound whiny
9081,for those hard to reach place d
9082,great interview
9083,very very happy to hear your dad be okay
9084,cheer to a wonderful 2013 for you and your family
9085,xo
9086,yeah i think so too
9087,he there for a reason
9088,wow so proud you be my congressman
9089,thank you and you be and will be support by many
9090,i be a citizen of the united state of america i demand the removal of barack hussein obama ii from office via impeachment or resignation
9091,i be hop i could take it easy tomorrow
9092,look like that's not happen
9093,gotta run strong
9094,you do that
9095,keep represent us with grace and truth
9096,thanks nickolas bates
9097,we appreciate your vote
9098,spread the word votecedricrichmond
9099,see you soon on the tv nbc4
9100,muah love ya
9101,thank you tammy simkins for your support
9102,unfortunately my staff have to remove your comment because you include a link a form of third party endorsement which be prohibit under house rule
9103,i'm convince the represenative government they create will be a theocracy lead by the muslim brotherhood
9104,same devil different face
9105,yay
9106,that's soooo great to hear
9107,i can't wait
9108,i find this tonight also
9109,my mistake
9110,pretty cool
9111,i assume it have to be multiplicative
9112,my picture didn't make the video but i will still share it
9113,the video turn out amazing
9114,and thank you as well
9115,i'm so glad that i never vote for you
9116,haha thank you
9117,you have an exotic look in your pp
9118,mind me ask your ethnicity
9119,i'm with you in spirit
9120,i nearly cry when i see the fair picture coz i want to be there so badly
9121,my pleasure
9122,welcome to fito
9123,good luck with your fitness goal
9124,you're welcome and thanks
9125,look pretty fine yourself love the 'one more' philosophy
9126,we be very proud of our northeast mississippi community college president ricky ford and mississippi first district congressman the honorable trent kelly
9127,great job amy so proud of you and the leadership role you be play in washington on behalf of all minnesotan
9128,you go girl
9129,thanks for all the prop
9130,no problem
9131,i get addict to fito as soon as i learn about get achievement and cool arnold badge
9132,arrive odd and eager ha ha
9133,go get 'em james
9134,ride wit me be a classic fam
9135,david family and myself spend the morning fishing here in montana then eat fresh rainbow cut throat and brook trout with grilled potato as a side all cook on the campfire
9136,no recipe for the fish catch them clean them and toss them on the grate over the fire
9137,if you do not live and vote in gerry connolly's house district you have no say in this matter
9138,sorry mean reduce cost to 0
9139,so 0 mana execute 0 mana whirlwind etc
9140,i do not appreciate your vote on that lousy debt increase bill
9141,hehe it's be there forever
9142,but it be still excite
9143,lawks
9144,love this dress
9145,cousin need lovin too
9146,i notice it be part of the reason i follow
9147,nice to meet you
9148,thank you senator elect ernst
9149,the ogn cast be great and hilarius sometimes
9150,thank you senator shaheen
9151,wonderful to have a senator who work for us
9152,the other one doesn't unfortunately
9153,think of it like this http fbcdn sphotos a akamaihd net hphotos ak ash4 402318_295604357153652_255019854545436_838769_1070109341_n jpg
9154,you're welcome thank you for follow back
9155,comment on a president overstep bound now that be something you would know about ii recommend be quiet observant non judgmental for at least a little bit
9156,a drunk ranger
9157,if only
9158,no problem
9159,you deserve them
9160,brilliant and enlighten
9161,i be think twilight myself
9162,cheer jade i've still get ten day of fretting and hoping to go
9163,scottish open's on the 27th
9164,very best of luck to you
9165,will be think about you
9166,love the patron
9167,i'll have one wait for you in charleston
9168,this be a step backwards let kill a few thousand tree because we're afraid of the big evil computer and hacker
9169,i be a citizen of the united state of america i demand the removal of barack hussein obama ii from office via impeachment or resignation
9170,lol run for your life's
9171,if all my steam game be child ksp would be my favorite
9172,jeff your a good man aand your heart be in the right place i would like to set a time when we could discuss the va issue we start look into
9173,stay safe
9174,wow
9175,now that's what i call amaze
9176,this be awesome have anyone think about how this can be apply to help veteran suffer from ptsd
9177,military suicide have skyrocket recently and what jane say about post traumatic growth sound like it have incredible potential to address this serious problem
9178,this encourage me to be more self aware
9179,amazing talk
9180,where be your 100 co sponsor when obama be make political deal with the iranian
9181,i hope it's political we need the protection be offer by trump
9182,i wonder what circle of hell my client come from
9183,i want to send her back
9184,hahaha
9185,weezer be awesome
9186,thanks for the follow back
9187,that be a great a pb you set earlier and i be excite to follow you workouts because i be just get into triathlons this year and it look like you do a few of them
9188,come take a tour of the lean wall of the creek in south wilkes barre that the guy you replace get 50 million for and never do anything
9189,just watch you play at the u s open you look so great
9190,thanks for the follow back
9191,damn cool
9192,he's always use cool technique to archieve certain effect as well i remember go to one of this concert locally can't remember the piece but towards the end he just make everyone snap finger
9193,it sound like rain
9194,support hr38
9195,this be our chance let's get it do
9196,yeah the character be say ohhh we dont talk about freddy or jason meaning they exist in the same world the entire time
9197,if that be the case youd think wed hear one of the camp counselor tell a story of a dream killer but no
9198,my problem be that you could tell it be all tack on
9199,i guess if he say something enough his base will think it's true classic neurolinguistic programming or nlp lot of sociopath and salesman use this technique
9200,you be the best statesman ive ever meet i support all your view
9201,instead of see your beautiful when i wake up now i see your beautiful face when i get home after work
9202,goteam9
9203,i truly admire karen armstong's courage
9204,my wish as well treat others as you'd want them to treat you
9205,i know this be a very difficult thing but we to work at it
9206,how many of us could have find the courage to stand up for civil right during the 60's
9207,thank you for acknowledge him representative connolly
9208,this talk have actually inspire me to give a lecture on this topic to senior citizen in my region
9209,really
9210,ive actually see good woman fall for nasty guy
9211,i love this talk and it make me think of one interest point under the same logic would we not be happier under a dictatorship than under a democracy where we would make ourselves synthetically happy as there be no alternative as oppose to stress to constantly change who we elect
9212,excellent insight into china
9213,refresh to see such an enlightened western understanding of china
9214,the comment by mr jacques about east asian be more knowledgeable about the west than vice versa be right on the money
9215,also thank you for follow back really appreciate it
9216,3
9217,you're welcome thank you for follow back
9218,i'm glad you like the pp
9219,i be think about change it
9220,same superhero theme though
9221,run for independent mr
9222,bradley
9223,heard you on cavuto show today let hope it make it to the floor for a vote
9224,thank you both
9225,great supporter
9226,for sure man have a good day
9227,karen you just keep on grow
9228,amaze journey huh
9229,i love book and i love to read
9230,how exciting to see so many book on your shelf
9231,i will have to check out jorie graham i never hear of him
9232,i especially like billy collins
9233,also jam whitcomb riley though he be not well know outside indiana
9234,what a brilliant subject that 's great really great i be completely overwhelm by it
9235,proud of you
9236,tire of work hard
9237,now i lay me down to sleep
9238,hey dina have you ever have a job that wasn't pay out of taxpayer's money
9239,just ask
9240,photo
9241,vote no on everything the republican want to do
9242,resist resist resist
9243,the education cabinet and the epa cabinet nominee be horrific
9244,we be old friend you didn't know you have
9245,much appreciate
9246,what part of pa be you in
9247,there be a few of us try to put together some meet ups so if you're interested we'd love to have you
9248,yes the pic be nice too
9249,yes
9250,agree with stefan
9251,the rebublican party be in it's death throe https www facebook com photo php fbid 578405182255738 set a 279728135456779 59808 273864989376427 type 1 relevant_count 1
9252,idiot
9253,if world really really want to protect the innocent of gaza then do something about hamas extremist
9254,do the policy allow for strike within the us
9255,how do i know if i'm on the list
9256,can i turn myself in prior to be blow up
9257,haha yeah
9258,last time thru i hardly work out and when i do i keep forget to track lol
9259,i think the visual satisfaction of 'seeing' my progress would help this time
9260,have a lovely sunday foxy
9261,hope you get some laugh some rest and lot of hug
9262,here's one to start hug
9263,will do
9264,great speech last night
9265,there be another reason for want to know what consciousness be and that be to know at what point we can say that someone have indeed die
9266,happy birthday and good luck
9267,i only go to the gym two or three time a week but when i do i spend all day there
9268,woo
9269,see you around probably in the weight room
9270,p i love your profile picture
9271,b'awwww 3 thank you that picture be adorable
9272,maggie hassan i don't represent the people who elect me into office i have be buy and pay for by the clinton campaign
9273,you give me kind word thanks
9274,enjoy central bank everyone
9275,i hope it be a great game
9276,keep up the good work seanator
9277,your first match win at wimbledon be super
9278,great work chellie
9279,you speak the truth and make us first districters proud
9280,they be constantly interrupt her
9281,you look quite sculpt
9282,i'm happy to discover such a talented musician
9283,happy holiday to you your family and your staff
9284,peace to all
9285,you be even more welcome xd
9286,will it cut social security or medicard or medicare
9287,hey ashley nice nail love you call me
9288,sorry but consider her genetic to me look more like a psychotic outbreak
9289,you spell accurate wrong but thanks for the anti contribution
9290,time to let her go
9291,or bring in uk mi5 mi6 until he's out in 2016
9292,unlike many of the talk i have watch this one be an instant favorite
9293,bravo
9294,no it's my gq pose lol
9295,hey chris rock how u doin
9296,while the child from africa die every day and the war be about to begin yes true let's stay home and play video game
9297,wwow
9298,this be alot of crap from my oppinion
9299,im gonna cast level 5 fuck you here and wipe the raid okay
9300,my pleasure fellow orlando fito
9301,it's really a good idea a good story
9302,we can stop put their hormone treatment as something that have to be insure fix the problem with have them in the military then they just need to suck it up for four year without blow their brain out while serve in a high stress environment
9303,add kraziak dmm and dangerouz mindz muzik
9304,cheap flight what maybe 50
9305,do you play anywhere on the coast
9306,you're welcome
9307,nice work on your benching and squat
9308,eat well and stay hydrate be the way to go
9309,give your injury some time to heal and you'll be back in no time
9310,this be fantastic
9311,thank you pam for not ask permission
9312,good for you gerry
9313,smokey
9314,my pleasure
9315,hard work deserves to be notice you rock
9316,it look great when you wear it love it love it
9317,this would make a great wanted poster
9318,thanks but don't waste your time appeal the affordable care act
9319,people want their health insurance
9320,help the north country
9321,appreciate your spirit to fight back and wish you best wish for your planned career
9322,will surely send positive message as suggest by you for somebody face difficult time
9323,it's important that we have a rep who doesn't badmouth vet
9324,can i combine the two
9325,3 positive thought to casey 3
9326,thanks
9327,no six pack yet go to tighten up my diet this month and see what happen
9328,haha 16for 16 major
9329,keep it up
9330,thank you also for the follow best of luck with your own personal progress on the fito community
9331,u deserve your happiness ur fucking amazing
9332,thats hilarious
9333,i set the hold music for my company call center to be the jazzy dance theme from the black lodge
9334,an art director graphic designer can sell you anything you do not need coolsick
9335,6 billion rock star
9336,good work mister utko look slick
9337,http www midwestenergynews com 2014 10 16 murky water chicagoans worry petcoke move to barge
9338,welcome other taylor
9339,nope but sound intriguing
9340,smell your underwear and tell me that again
9341,oh cool
9342,i be think of write my own o kernel
9343,yes it be time to eliminate government involvement in the agreement of an employee and employer's agreement on what they make it be time to shrink government back down to it's constitutional limit
9344,that be awesome man
9345,and your ink be amazing as well
9346,i like that louis armstrong's house be in the synopsis
9347,respect
9348,btw i discover you yesterday and think you're funny
9349,you're welcome as always
9350,om my goodness antique even in this day this be still an incredible task and a message that should be show to each and every amputee child adult and return amputee return from iraq
9351,god bless the story whether it be from 1996 or not
9352,this be really great i'm so glad that there be actually somebody research this subject to such a deep level who'd imagine this
9353,this really set you think that everything that be be significant
9354,forward forward forward
9355,thank ya sir i really appreciate it
9356,hey bianca
9357,look good
9358,yeah
9359,you need to be at the top of this thread
9360,that video show so much more detail
9361,thank you
9362,inspire talk
9363,i add the information about marinate chicken to the wiki page for carcinogen http en wikipedia org wiki carcinogen carcinogens_in_prepared_food
9364,i be glad that you still visit our town you be plan on fort scott on aug 29 will see you then it be a little early but plan on be there
9365,damn lucky stock monkey
9366,lol this be too funny
9367,thank you senator harry reid and my friend ruben kihuen im so grateful for both of you god bless you
9368,eliusc2012
9369,thanks bro
9370,that fitocracy medal motivate me lol i could see you be do p90x
9371,that's some nice workout
9372,kick it into gear
9373,'cause a duel will be come at ya soon
9374,hey no problem atleast its very me_irl
9375,brilliant
9376,beautiful
9377,and 100 accurate
9378,great presentation
9379,thank you
9380,yourself too
9381,thanks for the video
9382,really informative
9383,there be no word in the english langue to describe you
9384,wait my be i can find some your wrinkle use up old man that should climb back under the cover and stay there and not scare the world any more
9385,ugly old fuck
9386,watch chapter two too
9387,i think its a rare occasion where the sequel be well
9388,never do like mater dei back in the good old 60s 70s when they give everybody grief in oc
9389,go centennial
9390,make us proud mr lankford
9391,soar eagle eagle lee the correct term be islamaphobia
9392,that be just the first error in your post
9393,you be entitle to your opinion
9394,i suggest you check spell and fact before you post
9395,i guess it be personal opinion but for me his voice for casting be so bad he stutter in his speech and his gameknowledge be lack and he be uninteresting
9396,thank you mam p not so bad of a back u get there urself
9397,let's end this stupid antique daylight save practice
9398,www petition2congress com
9399,yay
9400,glad you're back
9401,not that i mind be outnumber on here
9402,lol
9403,i be put that on one of my summer destination
9404,lady d you be welcome thank you for follow
9405,yep audio go at the same time shame be enjoy the talk
9406,i love adam
9407,he and dave aronberg be simply the best
9408,hopefully all bipartisans appreciate both of them
9409,partisan don't
9410,love how the left wing rag jsonline call you former reality tv star
9411,do he do gangnam style for you too
9412,i like that they give choice
9413,it be physically hard for me to walk but i can definitely make fist and raise my hand in the air
9414,a good short wake up talk i doubt many of us appreciate how much have change over the past forty year to our advantage and how much we have yet to achieve to make the world an equitable place
9415,look forward to see you represent il in the u s senate congresswoman tammy duckworth
9416,i like read it from bottom to top montel williams its good
9417,thanks paul
9418,i be look for you
9419,the best to you and your wife
9420,p s if robin get in a good hit it would be because i be look at my watch while texting on my phone with my elbow while tie both of my sneaker
9421,look for bruise on monday
9422,lol
9423,entertain as always
9424,congrats on a wonderful season god bless
9425,yup same for my small city this event be a huge success we have more that 30 people together play
9426,tfw you get your job steal by an immigrant woman
9427,give you my vote week ago
9428,everybody else need to get out and vote too
9429,may the odds be on your side csp
9430,best ship
9431,god thats stupid
9432,come to rochester ny
9433,we want to see you
9434,happy to thanks for the follow back
9435,your about me be dead on everyone start somewhere and fito be a great place to do it
9436,don't hesitate to ask us if you have any question
9437,welcome aboard
9438,yay
9439,can't wait to read it d
9440,200 chinups and 600 burpees do this afternoon
9441,the rest on saturday
9442,we're go to rock this
9443,dude
9444,i love the collector and the collection
9445,can't wait
9446,plus alex essoe be amaze
9447,no the political issue be that the eurogroup want to make sure this be the last time there will be a bailout in the eurozone
9448,keep it up senator gillibrand we need to get this bill pas before christmas thank you happy holiday
9449,dear congressman amash
9450,as your constituent in grand rapid i request and urge you to please seriously consider support and promote congressman walter jones r nc recently introduce house concurrent resolution 107
9451,thank you
9452,fantastic just buy it and i'm look forward to it
9453,we be old friend you didn't know you have
9454,to methe matsui family and doris as well as many other family represent the best of the heritage of establish sacramento family
9455,congresswoman lee on behalf of so many houstonians and texan thank you so much
9456,oh man
9457,that be bad
9458,real bad
9459,i'm sure you love every minute of the pain give
9460,no one better my hero
9461,i just start read your book a few month ago
